,tit,body,comment,time,keyword
197,노트북으로 룬코어와 재생까지 다하면 힘들어하나요?,넷플없이 노트북에 룬프로그램 다 깔고 재생까지 해서 앰프로 usb입력하면 ​많이 힘들어하나요?  그리고 핸드폰으로 리모트하고요. (주로 타이달 스트리밍과 가끔 dsd재생합니다)​이렇게 쓰니 컴터가 에러가 잘납니다. ​4테라의 dsd 파일 외장하드에 연결도 되어있긴한데 그게 그리 힘든건지.​룬코어랑 네트워크플레이어를 분리하는게 정석인가요?​저만의 문제같은데 노트북을 바꾸면 괜찮을려나요​​4-5년전 i5 노트북 -usb케이블 - aio - m84(사이몬 오디오)스피커 이렇게 연결되어 있습니다​​룬 개념이 너무 어렵습니다 ㅠㅠ 도와주세요~​​최대한 간단히 쓸려고 넷플은 배제했는데 힘들어요..,"[['로딩에 랙이 많이 걸려서 사실상 사용이 어렵지 않을까요? 룬 뉴클리어스 기본형도 4테라 차니까 버벅이더군요. 그래서 플러스로 업글했거든요.'], ['노트북도 종류가 너무 다양하고 제품별 성능 차이가 심해서...ㅎ.\n일반적으로 i5정도 이상이면 큰 문제는 없겠죠.\n단, 오디오용으로 최적화하면 좋죠.\n물론 하드웨어적 성능이 좋으면 더 좋겠죠.\n잘 되시길..'], ['오디오 전용이 아니면 음원용람이 커질수록  i3는 힘들고 i5이상 성능이 있어야 하더군요'], ['I5 씨퓨에 램 8기가정도면 쾌적해야하는데요. \n음원도 4테라면 별문제 되지않습니다.\n그 사양에 20테라 음원도 잘 돌려보았습니다. \n외장하드가 USB인가요 아니면 Nas ? 속도를 한번 체크해보시구요.\n윈도우즈 문제일수도 있으니 OS재설치후 가능하면 다른용도로는 사용하지마시고 룬전용으로만 사용해보세요'], ['감사합니다. 외장하드 유에스비에 8기가램에 다른프로그램 안돌려요. 윈도우 두세번 깔아도 그래서 기계문제인가도 싶습니다.'], ['그것 좀 이상하군요 \n타이달도 끊기는지요?\n룬을 휴대폰으로 리모콘을 사용하신다면 룬서버를 설치해서 비교해보세요...'], ['타이달은 잘돌아가는편입니다. 안될때는 음원 타이달 다 안되고 될때는 둘다문제없어요. 놋북이 이상한가싶습니다. 감사합니다.']]",2021.04.23. 10:39,스피커
198,psb x2t vs 포칼 조라 816,2개 스피커중 어떤게더음질이좋을까요??x2t살려고했는데 인테리어가 너무해친다고 와이프가반대해서요.조라 816중고로 가져오면가격차이도 크지않을거같은데 이건이쁘다고하네요,"[['중저 위주x2t 중고음 위주816\n올인원 사용 목적이라면 psb가 더 좋습니다'], ['영화에 클래식까지면 x2t이군요 가성비진짜좋네요 다시설득해봐야겟어요\n답변감사드려요'], ['816 중고 싸게 구입 가능 하다면 둘다 구입하시고 조금 손해 보고 팔더러도 선택을 넘기는게 좋을듯 \n그런데 816 구매 하시면 금방 안팔릴겁니다.. ㅜ'], ['816이 인기가없군요 ㅠㅜ'], ['사모님 말 들으시는게 좋습니다. 그래야 다음 업그레이드도 가능합니다. 어차피 쿵쿵거리는 저음은 영화보실땐 소리 줄이셔야 합니다. psb가 저음에 강점이 있는 스피커지 포칼 코라가 저음이 부족한 스피커는 아닙니다. 중고로 파실때 가격방어도 포칼이나 B&W 처럼 일반인들어게 더 유명한 브랜드가 나을 겁니다.'], ['미래를 염두에두시는 혜안이잇으시네요 ㅎㅎ 그부분을생각못햇네요'], ['오디오도 자동차처럼 처음 감가가 많습니다...특히 스피커는 한두체급위의 중고로 시작하시는게 경제적이고 팔고 사면서 여러 경험을 쌓으시기 좋습니다.'], ['816이 x2t보단 한체급위인건가요 ㅎ 생각한갓보다한급위중고로시작해야 안자꾼다고이야긴들은거같아요 ㅎ'], ['PSB 는 Imagine 시리즈부터가 찐입니다.\n 포칼 816 추천이요'], ['답변감사합니다 ㅎ 근데 x2t도 이미진시리즈아닌가요? psb imagine x2t요~'], ['PSB Imagine b\npsb t1\npsb t2\npsb t3\n\n요넘들이 워낙 가성비가 좋아서 그리고 음장이 달라요^^'], ['x2t imagine 이네요 ^^;;'], ['psb t3의 이야긴 많이들었습니다 근데 t3 지금도판매하나요??? 판매하느느곳을 못봣네요'], ['중고로 구하셔야 되요^^\n\nPSB T2 가 가성비로는 가장 좋습니다.'], ['중고로구해도 x2t의 3배군요 ㅎㅎ 평은엄청좋네요 ㅎ'], ['코라가 신품 구매해도 무방할 정도로 소리는 좋아요. 다만 입문기인데 가격이 그모양이라 B&W 603S2로 가죠. 코라 가시려면 826 중고로 가고, 816 가느니 X2T 신품에 차액으로 DAC나 케이블 업글 하겠습니다. 아, 물론 와이프 의견은 중요하구요 ㅋ'], ['다시힘써봐야겠네요 ㅎㅎ 감사합니다 가격을 어필하면서 다시한번 설득해야갰네요 ㅎ'], ['코라 저음이 많이 부족한 톨보이입니다. 엔트리급이 아닌 톨보이인데도 저음이 50Hz 밖에 안됩니다. 북셀프보다 적은 저음입니다.중고거래는 당연히 PSB가 훨씬 잘됩니다. 헤드폰도 포칼일 정도로 포칼만 사용하는 사람이지만 개인적으로는 X2T 삽니다. 고민하는 시간이 아까울 정도로요. 그리고 1:1로도 비교해봤습니다. 위의 쿠루세이더님이 함께 비교해봐서 정답을 이미 가르쳐주었죠. \ufeffhttps://cafe.naver.com/audiodudu/270437\ufeff'], ['snake님 답변기다렸는데 감사합니다 다시설득시도해랴겠네요 ㅎ\n혹 엠프 데논 2500이랑 프라이메어i25랑은 어떨까요??\n2500신품과 i25중고가격이 비슷해서 먼저 살수있는겅 살까생각중입니다'], ['X2T라면 데논 2500이 정답입니다. PSB와 데논은 베스트매칭이고 정말 좋은 소리를 내줍니다.'], ['넵 그냥맘편히 예약걸어두고있어야겟네요 ㅎㅎ 명쾌한답변감사드립니다'], ['snake님 외람된 질문입니다만~\n2500이 당연히 더 좋다고들 하셔서...그런줄은 알겠는데..\n나드375하고의 차이도 많이 날까요~~?\n(현재 나드375+뮤피v90 입니다)'], ['2500이면 차이가 납니다.1600이면 미요한 차이고요.'], ['중고는 x2t가 더 잘팔려요'], ['5마넌만낮춰서올려도 후딱팔리는걸본적이잇긴합니다 ㅎ'], ['x2t 한달 사용하고 처분 했습니다. 일단 저음이 너무 강하고 디자인 진짜 적응 안돼어요 지금 현재 금액대 같으면 10만원 정도 더 쓰시고 엘탁스 괘짝 으로 들이시는게 나을꺼 같습니다.'], ['디자인적응힘드신가요 엘탁실물보면괜찮나요?? 엘탁도후보였는데 와이프보여줫더니 이게모야 ㅜㅜ 이걸우리집거실로 들이자고? 라고하더라구요 ㅎ'], ['스피커를 여러대 놓고 사용하심 그나마 볼만한데요 x2t 하나만 놓으시면 영.. ㅎㅎ 갠적으로 x2t 들이실바에 엘탁스가 나아 보여요'], ['개인적으로 저는 궤짝이 더 디자인은 그닥 좋은줄 모르겠더라구요~~^^;;\n여유되면 t2 들이고 싶습니다 ㅎ'], ['성능은둘다좋은스피커들인데...아쉽네요 ㅎ'], ['psb t2 중고 잡으세요.psb 는 x자 들어가는 모델은 피하심이 '], ['이유가있으실까요?ㅎ  t2는 t3보다도 수량이적은걸로알고있어서 잡기진짜힘들거같네요 ㅠ'], ['둘중에 구지 고른다면 코라816 고르겠는데요, 상큼한 맛이라도 있으니 까요저 가격대라면 공간이 아주 크지 않다면 북셀프가 나은 선택이라고 봅니다.중고로 100만원 근처면 가성비 우수한 북셀프들이 줄서 있습니다,구지 보급형 톨보이 신품 구입할 이유가 없습니다.'], ['40평정도거실크기입니다 앰프가 데논2500예정인데 어울릴만한북쉘프추천부탁드려도될까요'], ['공간이 넓은곳이라 북셀프라도 저역이 좀 있는 제품이 좋겠네요. 비엔더블유 cm5 s2, 케프 r300 ,  다인 익사이트 x16 중에 먼저 나오는 넘 잡으시길 '], ['추천감사합니다 열심히알아볼개요!!'], ['lx-3, lx4, lx5 공간에 맞게.. 저 둘아니고라도 더 좋은 스피커가 줄을 섰쥬..'], ['https://link.coupang.com/re/CSHARESDP?lptag=CFM91057038&pageKey=5046598842&itemId=6801608257&vendorItemId=74094302595'], ['엇 스피커추천감사드립니다 4랑5가 거의가격이비슷한하네요'], ['5가 저음이 더 많을거고 4는 훨씬 단정하겠네요']]",2021.04.23. 09:01,스피커
199,스피커가 문제인가요?,안녕하세요 얼마전 LP에 관심이 생겨 입문자용 검색하다 오디오테크니카 AT-LP60XBT  를 구매했습니다. 소리가 너무작아 기존에 쓰던 마샬 스피커에 블루투스 연결하여 듣는데 이건뭐..LP판을 사러간곳의 웅장하고 소름끼치는 음질을 잊을수가 없네요. 그것까진 아니지만 초보용 검색했는데 엠프를 사야하는지 스피커가 문제인지 도움 요청합니다. 초보용 저렴한거 원하는데 검색해도 잘 모르겠어요,"[['오디오를 업그레이드하는 이유겠죠LP레코샵에서 저가형턴을 사용할리도없구요아무래도 조금씩 더 알아보시구연구해보셔야 할듯요~~'], ['네 감사합니다. 음악듣는게 좋아 찾아보니 듣기위해 엄청난 공부를 해야한다는걸 배워갑니다^^'], ['아날로그는 제대로 세팅해서 (사용자의 기대치를 기준으로) 어느 정도의 음질을 얻어내려면많은 시행착오를 거치셔야 합니다.많은 분들이 경험하신 자료를 공유해놓으셔서 그나마 요즘에는 자료를 찾기 쉬운 편이긴 합니다.입문용이라는 전제를 달고 있는 장비는 차후에 어떤 것을 구입하시더라도 피하시는 것이 맞습니다.LP는 물리적으로 발생시키는 미세신호를 큰 비율로 증폭해서 소리를 들어야 하는 기기라서매우 민감하고 까다로운 소스이기 때문이죠. 그만큼 정교하게 만들어진 플레이어와 앰프를 쓰셔야 합니다.블루투스를 메인으로 사용하신다면 당분간은 LP는 접으시는 것이 정신건강상 좋으실 겁니다.제가 생각하는 아날로그 입문기는 80년대에 생산된 인티앰프와 테크닉스 SL-1200 턴의 조합입니다.이유는 LP의 전성기때 만들어진 인티앰프들은 당시 가장 일반적인 소스인 LP에 최적화 되어 있기때문인데 가격도 저렴하게 구하실수 있습니다.다만 턴테이블의 경우는 신경을 쓰셔야 하는 부분이라 저가제품들, 특히 테크닉스와 유사한디자인으로 복각되어 생산되는 최근 신제품들은 톤암의 조인트 부분등이 예전 제품과는 확연하게정밀도 면에서 떨어지는 것들이 많아서 구입을 자제하시는 것이 좋습니다.몇만원 아끼려다가 중고로 처분도 못하는 상황이 되어 버리는 것이죠.높은 인기를 누리는 기기는 분명히 한끗발 다른 무엇인가가 있다는 것이라는 거죠.모쪼록 LP에 대한 모처럼의 관심이 차갑게 식어버리지 않았으면 좋겠습니다.'], ['좋은 음질의 음악을 듣고있으면 너무 마음이 차분하고 평온해지는게 투자할 가치를 느끼게 하더군요. 답변 너무감사합니다. 열심히 공부해 보겠습니다'], ['저와 같은 턴과 스피커를 사용하시는군요.  저도 마샬로 듣다가 스피커, 앰프 지르고도 만족을 못해서 턴테이블하고 포노앰프까지 바꿨어요 ㅜㅜ'], ['ㅋ 저의 뻥뚤리지 않는 그 맘을 아시겠네요 ㅋ'], ['자~~알 알고 있습니다. (이거 누구 말투같은데.. ㅎㅎ) 제 두달전 모습 같아서요. 저도 원래 마샬 스피커로 폰과 블루투스로 연결해서 멜론과 앱라디오만 들었었어요.그러다가 집에 좀 있는 LP를 들어보려고 블로그 몇군데 검색해서 그 턴을 산건데... 거기서 멈췄어야 했는데 ㅎㅎ더 큰 마샬 워번 살까 하다가 그 금액이면 오디오 입문이 낫겠다 싶어서 두두오 가입하고 청음샵 갔다가 눈돌아가서 스피커, 앰프,CDP 사고나니 이번엔 턴테이블 소리가 맘에 안들더군요.그래서 며칠전에 턴테이블도 새로 사고 포노앰프까지 들였어요 ㅜㅜ정앵님도 차분하게 여기저기 많이 알아보시고 좋은 선택하시길 바랄께요.']]",2021.04.23. 08:56,스피커
200,AV 다채널 앰프를 사용하면요,음원은 2채널인데다채널 앰프를 통해 5.1채널 스피커로 들을 수 있는지 궁금합니다.​2채널 소스는 전면 프론트 스피커 2개로만 나오는지아님 상관없이 5.1채널 스피커 모두로 소리가 나오는지요?​지금 음감+TV연결 위해 AV시스템으로 갈까 고민중인데요.AV시스템으로 바꿔도 시디나 티비 소리가 2채널로만 나오면굳이 AV앰프로 갈 이유가 없을 것 같아서요.​이것저것 검색해보는데너무 기초적인 거라 그런지 답을 못 찾았어요ㅠ​,"[['리시버에서 다양한 모드로  5채널로 변환 해주는 기능이 있습니다.'], ['고맙습니다! 이제 속이 다 시원해지네요ㅠㅠ'], ['보통 리시버에서 돌비 프로로직으로 2체널을 다체널로 뿌려주는데 이게 카레 2인분을 물 붜서 5인분으로 불리는거라고 보면 됩니다. 별도의 소스기나 넷플등으로 다체널 영화볼꺼 아니라면 AV리시버는 의미 없습니다.'], ['카레 2인분 ^^   비유가 찰집니다.'], ['영화를 보는게 아니라면 음악은 2체널로 듣는게 더좋아요게다가 av리시버는 음악감상용 음질은 많이 떨어져요~'], ['고맙습니다.\nAV리시버와 음감용을 따로 두는 쪽으로 가야겠습니다 ㅎㅎㅎ'], ['고민하던 문제가 여기 답이 있내요 감사합니다']]",2021.04.23. 08:12,스피커
201,사운드바 hdmi arc 셋톱박스 연결시 질문입니다.,이번에 폴크 시그나s2  사운드바를 구입하였는데 셋톱박스 와 사운드바를 옵티컬로 연결하고 사운드바와 tv뒷면의 hdmi arc 와 동시에 둘다 연결해서 사용해도 되나요? 셋탑박스나 tv 리모컨으로  tv전원을 켜고 끌때 tv와 스피커 모두 전원이 작동하지 않을까 싶어 질문 드립니다.,"[['사운드바와 tv를 arc끼리 그리고 셋톱을 tv의 다른 hdmi에 물리면 됩니다'], ['그리고 tv에서 셋톱이 물린 입력 hdmi입력번호 선택하시면 사운드바로 음향출력되고 리모콘 3기기 모두 통합됩니다. 셋톱 리모콘으로단 tv가 전원통합기능 cec가 있어야합니다'], ['소중한 답변 감사합니다. 알려주신 대로 설치 해서 잘 듣 도록 하겠습니다.']]",2021.04.23. 06:28,스피커
202,"결정장애 스피커 , 앰프 레가 엘렉스",정말 결정장애 중입니다.전부 비싼 수업료를 치뤄야 만족한 결론을 얻을 텐데.. 일단 Bower Wilkins 를 염두하면서707 계열 혹은 600계열 중에 막 갈등하다가엘락 카리나가 좋다는 이야기에 또 혹하고 있네요침실에서 사용할 목적입니다그리고 앰프는 레가 엘렉스이구요...비싼 수업료대신 고견을 여쭈어봅니다​,"[['신품이면 직접 들어보시구요. 중고라면 하나씩 다 사서 듣어보시는게 좋을 듯요. 답은 본인 귀가 알아요.'], ['처음 시작은 b&w 가 무난하다고 하더라구요자기 취향을 아직 모르는 경우 시작할때요 그리고 그 다음은 수업료 내면서 하시고']]",2021.04.23. 04:39,스피커
203,ROON 궁금점...오린이를 도와주세요!!,"오디오 세계는 신기한 점이 많습니다.​항상 많은 도움 주셔서 감사하게 생각합니다.​pc-fi로 앰프 마란츠 2265B/ 뮤지컬 피델리티 V90 DAC/스피커 JBL L166 이용중 입니다.​문제는 앰프 출력 및 상태가 좋지 않아 음질이 컴퓨터 연결하여 듣기가 불편한 상태였습니다.​그리하여 roon이 궁금하여 설치하여 실행시켜 타이달 및 음원들은 듣는데 이상하게 소리가 한결 파워풀하고 섬세함이 생기고 음질의 변화가 컸습니다.​예전에 푸바2000 사용할 때는 음질에 따른 변화를 캐치 못하였습니다.이 부분의 궁금증이 생겨 문의드립니다.​일단 ROON 기능들은 잘 모르지만 음질의 변화의 큰 장점 및 향후 음원을 많이 보유하게 되면 좋을 것으로 판단하여 평생권으로 결제하였습니다.​타이달 어플 이용시보다 음질 차이가 컸으며, ROON소프트웨어 음질 향상이 있는 것인지 아니면 세팅에 업 샘플링의 효과때문인지 궁금합니다.","[['L166은 우퍼 울리기가 L65만큼 어렵습니다. 힘좋은 파워앰프를 물리면 좋은 소리 들을 수 있습니다. 2265로는 우퍼 제대로 못 울립니다.'], ['네ㅠ 울리기가 쉽지 않네요 참고하겠습니다.'], ['roon의 업샘플링과 디코딩 알고리즘이 좋은 것 같아요. 심지어 화장 과다 타이달 조차 룬 거치면 단정해지는 느낌이네요.'], ['지금 평생회원권 결재가 가능한가요???'], ['넵 신규 가입하고 14일 무료 기간있습니다.추가로 결제 선택란 한달/1년/평생 있습니다.']]",2021.04.23. 04:33,스피커
204,요런 식으로 만들면 어떨까요,​안녕하세요~AR18 사용중인데 브랜드 로고가 회전합니다~~~딱히 이유가 있을거라고 생각 안해봤는데말씀을 듣고 보니 저도 가로로 놓아 둘 수도 있겠군요!!​,"[['오호? 재미나는 스피커입니다 네 가로로 두는걸 너무 하고싶어요 ㅋㅋ 가로로 두려면 원래의 바닥이 옆면처럼 매끈하게 잘 되어있어야 가능하죠. 4면이 잘 마감 되어있는 스피커만 될거같아요'], ['네 옆으로 두면 마치 옛날 교실 벽에 붙어있던 스피커 같아요 ㅎㅎ'], ['왠지 스피커 새로 하나 들인 효과가 있을 것 같습니다.^^'], ['네 ㅎㅎ 뒤집어도 될 듯 합니다 ㅎㅎ']]",2021.04.23. 04:23,스피커
205,요런 식으로 만들면 어떨까요,스피커인데요..​원래 세로형태인데 이런식으로 가로로 만들구요​,"[['외관을 세련되게 만들면 멋질 것 같습니다~~~'], ['감사합니다'], ['가로로 놓는 게 의외로 더 안정적일 수 있습니다. 잘 만들면 멋있을 거 같네요 ㅎㅎ'], ['와이프님이 허락해줄거 같아서요 이런 디자인은 ㅎㅎㅎ'], ['지금 구상하시는 형태의 스피커와스텐드 설치를 보스 301-3로해서 운영했던적 있어요^^소리 좋았어요.'], ['오 궁금해요']]",2021.04.23. 00:39,스피커
206,lp 녹음방법 문의드립니다.,안녕하세요.​lp녹음의 경우 자체적으로 기능을 지원하지 않는 기종은  별도의 툴은 설치해서 녹음이 가능한가요?​제가지금 사용중인 turntable은 dp-300f입니다.​감사합니다:),"[['오인페로 녹음하면 되지만.. 음.. 그냥 요즘 usb 출력 되는 턴테이블로 사셔서 pc로 녹음 하는게 어떨까 싶네요.'], ['모노도 괜찮으심 핸폰으로 스피커에 붙여서 녹음하시면 젤 좋아요.   아님 마이크구입해서 핸폰에 녹음.   있느거 사용해서 녹음하시면 될것같은데요'], ['오인페가 어떤것인지 찾아보겠습니다:)\n핸드폰녹음도 한번도전해보겠습니다. 답변감사합니다~'], ['sony a10 녹음기에 y잭을 연결해서 녹음하시면 가장쉽고 퀄리티도 높습니다.'], ['헉! pcm-a10가격이 상당하네요']]",2021.04.22. 23:46,스피커
207,마란츠 PM7000N 과 어울릴 스피커,안녕하세요~~오늘 마란츠 PM7000N 구입하고 이제 스피커 고르고 있는 초짜입니다^^B&W 706 S2 or 606 S2 생각하고 있는데...Elac BS 312 이벤트 (스탠드포함) 를 보고 말았습니다.어느 쪽이 더 좋을까요?가격은 706 S2와 BS312 비슷한 것 같습니다.BS312는 7000N 으로는 울리기 좀 어렵겠죠??Elac 은 들어본 경험이 없어서 결정하기 어렵습니다.606 S2 와 706 S2 도 차이가 많이 나는지 궁금하기도 합니다..형님들 조언 많이 부탁 드리겠습니다^^ 감사합니다~,"[['제가 7005에 310ib 를 썼는데요. 312도 7005에 매칭한 것도 들어봤고요. 매칭 좋습니다. 엘락이 취향에 맞다면 사셔도 좋습니다.'], ['감사합니다 ~~ ^^'], ['마란츠와 B&W 많이들 추천하는 조합이죠.'], ['예~ 잘 알겠습니다. 감사합니다~~^^']]",2021.04.22. 23:26,스피커
208,M-ONE에 다른 앰프를 연결할 수 있나요?,안녕하세요 두두오에 가입하고 음악감상에 취미를 붙인지 이제 막 한달이 되었습니다.​그간 선배님들의 의견을 참고삼아 인티앰프 M-ONE에 스피커 LS50으로 간단하게 구성하여 듣고있는데요 M-ONE과 LS50중간에 파워앰프(진공관앰프)를 추가하고 M-ONE은 DAC용도로만 쓸 수는 없는지 궁금합니다​M-ONE 뒷면에 오디오 신호출력단자가 없는데  그러면 방법이 없는가요? 전면에 헤드폰단자를 출력단으로 이용할수도 없는건가요전용DAC을 샀어야했나봅니다.,[['저도 얼마전 진공관 앰프를 연결해서 사용하려고 했는데 헤드폰단자에서 출력을 꺼내서 진공관 앰프로 넣어서 사용했었어요. 아마도 그 방법 밖에는 없는듯 해요.\n저도 요즘 m-one을 보내고 다른 앰프로 갈아타려고 생각중이긴 하네요.^^']],2021.04.22. 22:27,스피커
