,tit,body,comment,time,keyword
597,차폐트랜스 or 멀티탭 or 차폐트랜스+멀티탭,안녕하세요​오디오 전원관련 궁금한 사항이 있어서 문의드립니다. ​일단 집은 신축아파트고 전기도 찍어보면 시간대 구애받지 않고 대체적으로 잘 나옵니다​최근 간간히 발생하는 스피커 노이즈 때문에 노이즈 필터가 있는 멀티탭을 보고있다가 차폐트랜스를 하나 사는게 더 효과적이지 않을까 하는 생각이 들었습니다. ​공업용 복권형 AVR도 노이즈필터가 들어가 있다고 들었습니다. 그런데 굳이 멀티탭 차폐트랜스 이렇게 따로 파는 이유가 있나요?전원을 좋게 하려면 연결하는 과정을 줄여야 하는데 차폐트랜스 + 멀티탭 조합도 많이 보여서요~오히려 안정적인 전압을 공급받기 위해 리니어를 추가하거나 고용량의 차폐트랜스만 쓰면 더 좋을텐데 하는 생각이 드네요~​소켓이 모자라지 않고 전력을 많이 사용하지 않는다는 전제하에(고출력엠프나 PC등 사용하지 않음)고려한다면 멀티탭보다는 차폐트랜스를 하나 구매하는게 더 좋은 선택일까요?​뭐 하나 구매하려면 너무 힘드네요 ㅜㅡ전기는 제가 잘 아는 분야도 아니고 손쉽게 DIY로 제작가능한 분야도 아니라서....​​​​,"[['트랜스만 하나 사서 들으시는 게 좋을 것 같습니다.접지 문제나 극성 신경쓸 필요도 없고 오디오 하시려면 하나쯤 두시는게 ㅎ\n튜브링크에 지금 공제하고 있던데, 제가 사용해 보니 가성비 최고입니다.\n원래 노이즈 신경 많이 쓰시는 분들은 소스기기와 앰프기기를 분리해서 트랜스를 각각 사용해야 효과적이라고 하더군요.\n저도 작은 노이즈가 간혹 생겨 알아보게 되었는데 가격이 천태만상 같아요.\n하이앤드 가실려면 서병익오디오 추천드리고, 그렇지 않으면 튜브링크 공제 관심가져 보세요.'], ['노이즈필터와 차폐는 근본적으로 다르다고 봅니다.\n필터는 일정 주파수를 정제하는 과정에서 음의 손실이 생긴다고 하더군요. 저급 차폐트랜스도 그렇게 처리하기도 한다는데, 튜브링크 뜯어 보면 전기선으로 벽체타고 들어오는 노이즈 차단 처리 잘 되어 있고 정숙해서 좋았습니다. ㅎ \n6개월 사용소감입니다. 거기서'], ['답변 감사합니다^^가격은 조금 더 나가겠지만 차폐트랜스로 하는게 나을것 같네요 ~~'], ['튜브링크에 중고매물 간혹 나옵니다. 매복하시면 금방 구할 수 있어요'], ['네 감사합니다^^']]",2021.01.15. 14:02,스피커
598,룸 튜닝 프로그램이나 음질 테스트 프로그램?,최적의 소리를 찾기위해 스피커를 움직여 보기도 하고 각도도 조절해보고 스피커 케이블이나 파워 케이블을 이것 저것 바꾸어 꼽아 보며 테스트하고 있습니다. 전적으로 귀에 의존하기는 하는데 어렵네요,"[['나드 m33을 사시면 됩니다......ㅎㅎ'], ['빌려주심 안됩니까?'], ['매킨토시men220 을 사시면 해결됩니다 ㅋ'], ['덕분에 뽐뿌 중이잖아요. 귀로는 어렵네요'], ['ㅋㅋㅋ'], ['핸드폰으로 Advanced Spectrum Analyzer PRO 라는 어플을 다운받아서 쓰보세요'], ['오 역시 있었군요 감사합니다 해볼게요'], ['적당한 가격에 비교적 정확한 측정을 하시려면 minidsp에서 마이크 하나 사셔서 rew라는 프로그램으로 측정해보시면 됩니다.'], ['네 제가 원했던 제품이군요 감사합니다 선생님']]",2021.01.15. 13:14,스피커
599,스피커로 음감시 저음에서 부르르 소리가나요 ㅠㅠ,안녕하세요~ 이틀전에 스피커 받아서 임시로 연결해서 영화도 보고 노래도 들어보고 있는중에 ​제목과 같이 저음이 강한 노래를틀면 아래 우퍼부분이 안팍으로 엄청 흔들리면서 무서운소리가 납니다​방안이 너무울리고 좋지않은소리가 나서 불량인가 하고 여쭤봅니다​참고로 리시버는 AVC-X3700H 사용중입니다 ​불량인지 또는 해결방안이 있는건지 궁금합니다,"[['이전에 다른스피커에서는 정상적이었나요?이런경우 스피커보다는 앰프쪽이 문제일확률이 큽니다.'], ['이번에 처음구매후 이스피커에 처음연결한거라 잘 모르곘습니다..이런경우 어떤 메뉴로 들어가서 어떤항목을 수정해야하는건가요? ㅠㅠ 번거로우시곘지만 부탁드립니다'], ['스피커와 리시버의 + , - 는 바뀌지 않았나요?'], ['지금은 업무중이라 집에가서 확인해보겠습니다만 아마 + - 는 잘 맞췄을꺼예요 ㅠㅠ 서라운드스피커 두개다 저런현상이 일어납니다..'], ['넵 잘해결되시길 바랍니다'], ['넵 감사합니당!'], ['뭔가 좀 과도하거나 정상적이지 않는 에너지가 들어가는 듯 한데요'], ['무서워서 일단 노래는 껐는데 앰프쪽 문제일까요?'], ['헐 이상하네요. 음원이 뭘까요?'], ['애플뮤직 에어플레이 입니다'], ['아 곡명을 알려주시면 저도 한번 들어볼까해서요'], ['zedd-candyman 입니다 감사합니당'], ['일단 음원에 우퍼를 떨리게 할만한 부분이 들어 있습니다. 이 곡은 작게 들으셔야겠네요.'], ['아쉽네요.. 그럼 스피커에 구조적인 문제인건가요? ㅠㅠ'], ['이유는 잘 모르겠습니다만.. 음악에 이런 소리를 넣은게 스피커나 오디오 입장에서 재생이 쉬운 음악은 아닌거 같습니다.'], ['나름대로 스피커가 최선을 다해 재생해준겁니다.우퍼 구경이 더 컸으면 좀 더 좋았을거 같습니다만.'], ['ㅋㅋㅋㅋㅋ 최선을다해 재생해준거라는 말씀이 재밌네요 톨보이는 이렇게 힘겨워하지 않는것같은데요 ㅠㅠ혹시 리시버에 서라운드스피커한태 n Hz 이하의 저역은 재생하지말고 우퍼에게 넘겨줘! 하고 명령하는 기능도 있나요? 10인치 우퍼면 지치지 않을줄 알았는데요 ㅠㅠ'], ['네 리시버에서 대역 잘라서 우퍼에 넘길 수 있습니다. 구경이 크면요. 원기둥 부피 공식에 따라서. 밑넓이 x 높이.  그래서 우퍼 앞뒤 흔들림이 급격히 줄어듭니다. 동일 부피 공기 미는게\n쉬워져요.'], ['아 서브우퍼로 넘기는 기능이 있군요 저노래틀고 우퍼쪽에갔더니 서브우퍼가 너무 일을 안하는듯하여서 여쭤봤습니다 제가 말씀드린 그런 기능 명칭이 따로 정해져있나요?'], ['스피커 세팅에서 서브우퍼가 담당하는\n주파수 범위를 세팅할 수 있을 겁니다. 자세한건 설명서를 ... 저도 잘 몰라요.'], ['네 지금까지 답변해주셔서 감사합니다!'], ['죄송하지만 앰프가 힘이 엄청 부족해서 생기는 현상 같아요!오래전 1000와트라고 광고하던미니컨퍼넌트에서 본 우퍼출렁임....'], ['진짜요? ㅠㅠ 9채널지원이라는데 센터스피커 품절이라 4채널만 연결한상태인데도 그럴까요?'], ['앰프가 뭔지 궁금하구요앰프 리어단에 연결 하신거죠?톤컨트롤 베이스를 많이 올리면 저런 현상이....'], ['네 원문에 적어둔 데논 AVC-X3700H 입니다 리시버라 따로 다이얼같은게 없는거같습니다 ㅠㅠ'], ['스피커 주변이 이상한 물체 둬서떨리는건 아니지요? 스피커 자체 공진인가요?'], ['네 저도 그런줄알아서 들고 테이블위에 올려서 본건데 우퍼부위가 혼자 막 춤을추네요..'], ['저도 들어보니 부분적으로 저음이 과도한 부분이 있습니다만 저렇지는 않습니다.\nPM-10,소프라2 조합입니다.'], ['따로 앰프쪽 수정하신거 있으신가요?'], ['아니요.\n그냥 검색해서 타이달로 들어보았습니다.\n소스기는 N10입니다.'], ['빨리 집에가서 셋팅을 다시해봐야겠군요 ㅠㅠ 답변 감사합니다'], ['뭔가가 고장이네요 음'], ['제가 봤을 땐 공진일 가능성이 있지 않나 싶습니다. 스피커를 바닥에 놔둬도 똑같이 그런다면, 그 다음에는 부르르 소리 날 때 다른 물건이 심하게 떠는 게 아닌지 살펴보시고 그 다음에 스피커 음원 앰프 순으로 의심을 해보셔야 할 것 같습니다. 혹시나 컴퓨터에서 틀은 것이면 저음부스트를 틀었다든지 하는 건 아니신가요?'], ['소스는 애플뮤직 - zedd candyman / 아이폰 이구 EQ는 건들지 않았습니다 ㅠㅠ바닥에 놓고 한번 재생해보겠습니다']]",2021.01.15. 12:03,스피커
600,네트워크 플레이어 사용시 허브를 사용하는 것이 좋을까요?,"고민하다 결국 네트워크 플레이어를 구입했는데요,​스트리밍을 할 때 현재 집으로 들어오는 신호를 분배하는 분배기 (와이파이 기능 없음, 아래 사진)에 함께  연결해서 쓰고 있는데, 검색을 해보니 이렇게 사용하면 노이즈가 섞여서 들어갈 수 있기 때문에 ​스위칭 허브를 따로 사서 연결해서 쓰는 것이 더 좋다고 하던데요,​살제로 사용해보신 분들이 생각하는 차이는 어떤지 궁금합니다. ​저는 그냥 여기다가 좋은 렌케이블만 물려주면 될 것이라 생각했거든요.  ​허브를 장착하면 소리가 더 많이 좋아지나요? ​혹시 추천해주신다면, 어떤 허브가 좋을까요? 넷기어 R8000을 추천하시는 분도 계시던데 가격이 만만치 않네요. ​그리고 랜케이블도 또 하나 구입해야 하는 부담이 생기겠지요... ㅠㅠ","[['먼저 HP1420-5G 정도 들여서 연결해보세요.충분히 효과를 느끼실겁니다.음감 전용 허브들도 많이 있지만 먼저 체감 해보시고 판단하세요!한때 허브5대까지 물려 사용했었습니다^^ ㅎ'], ['감사합니다. ^^ 네트워크 스트리밍 관련해서는 완전 처음이라 막막하네요.'], ['https://cafe.naver.com/audiodudu/290938   이 제품도 참 좋습니다!'], ['감사드립니다!! 위의 것은 가격이 좀 있네요 ㅠㅠ'], ['제 개인적인 생각으로는 음색을 변화시킬수 있는 하나의 변수가 더 생기는것 아닐까 합니다.\n\n랜선마다 음색이 다 다르더라구요.\n\n기기사이 랜선을 추가함으로서 음색이 변화하는걸 느껐습니다.'], ['오디오란 취미가 그래서 어렵군요... ㅠㅠ 답변 감사드립니다.'], ['허브의 세계는 아주 넓고 크지요. 한도 끝도 없는게 허브입니다.\n넷기어 약 5만원짜리 하나 공유기 앞에 벽체 나오는 곳부터 넣어보세요. 노이즈 꽤 잡히면서 체감되실 겁니다. 그다음 필요하시면 두두오 검색해 보시면 많은 정보가 있을겁니다.\n'], ['검색해보니 정보가 많네요. 근데 넘 어려워요 ㅜㅜ. 답변 감사드립니다! 좋은 하루 되세요 ^^'], ['저는 인입쪽 허브 iptime h6008-igmp에서 콘덴서가 없는 넷기어 gs108v4로 바꾸니까 먹먹하던게 나아진 느낌이 들더라고요그리고 설계상 전원단자가 랜단자와 가까우면 음질에 악영향이 있는 것 같습니다'], ['확실히 뭔가 바꾸면 나아지나 봅니다. 나아진다기 보다는 달라진다가 맞겠지요.. 정말 알아야 할 것들이 많네요... 답글 감사드립니다! 좋은 하루 되세요 ^^'], ['허브 교체의 경우는 나아진 것이 맞아요내부 사진을 보니 클럭이 미미하게나마 업글이라 만족합니다'], ['허브를 한개사용할때마다 그에따른 변수가 생깁니다.쉽게 말하자면 음색을 포함해서 소리가 변하죠매칭에 자신있는사람은 뭘하든 괜찮지만 아닌경우엔 허브를 한개씩 추가할때마다 안해도될 새로운고민이 생깁니다.그저그런 시스템에서는 허브를 추가하면 좋아진듯 느껴지지만 나중에 분리도가 높아질수록 그게 노이즈같이 들리기도 합니다.허브가 효과가 있느냐고 물으시면 상황에따라 좋을수도 나쁠수도 있습니다.시간과 열정이 많아서 무수한 시행착오를 경험하고 그걸즐긴다면 적극적으로 권장드리고 싶습니다.'], ['역시 !!! 동감합니다^^\n\n무조건 좋다고 기기만 늘린다고 좋은게 아니더라구요.\n\n하나하나 추가될때마다 세팅에 대한 고민이 추가됩니다.\n\n'], ['답변 감사드립니다. 좋은 하루 되세요! ^^ 저같은 사람은 그냥 허브 또는 허브 기능을 해주는 공유기하나로 만족해야할듯해요. 그런데 혹시 이런 질문 드리기 뭐하지만 허브나 공유기 하나를 할 때 랜케이블은 들어가는 쪽을 더 좋은 것(가격적으로 조금 더 비싼 것을 의미합니다)으로 해야할까요 나오는 쪽을 더 좋은 것으로 해야할까요? ^^ 제가 너무 어리석은 질문을 했나요?'], ['역시 흥덕님!!!!! 이게 정답입죠 ^^'], ['들어가는쪽이든 나오는쪽이든 둘다 중요합니다.\n\n제가 어떤답변을 드리던 효과를 보면 나머지도 분명 바꾸게 될겁니다.\n\n저라면 강원전자 cat8을 쓰다가 업그레이드할때는 최고로 비싼걸 선택할겁니다.\n\n중간에 어정쩡한거로 이것저것 바꾸는거 큰의미가 없고 케이블만 비싸다고 소리가 좋은건 또 아니에요\n\n기본적인 노력이 더중요합니다.'], ['감사드립니다!! ^^ 우문에 현답을 주셨네요!'], ['10000%공감합니다^__^ )주옥같은 말씀이십니다'], [''], ['햐 허브 검색 중에 흥덕님이 정답을 적어주셨네요\n'], ['노이즈가 생긱다는 표현은 많은데 구체적으로 어떤 현상을 얘기하는 건가요? lp들을 때도 잡음나고 그러는데 조금씩 간헐적으로 들리는 노이즈 잡으려 기기 자꾸 붙히면 오히려 역효과가 걱정된다는 생각입니다. 5만원대 넷기*제품 어떤 분은 사용하고 나서 소리를 잘라 먹어 역효과 게시글 있어요.\n차폐트랜스 사용하면 소리 맑아지는 듯 하지만 잡음만 제거하는 것이 아니라 일정 주파수를 잘라 버려서 적막하게 들리는 저가도 많습니다.\n허브에서 새로운 분기점이 생겨 잡음이 흘러 들어 오는 것을 끊어 준다는 이론으로 유효성을 얘기하나 반드시 좋은 효과를 보는 것은 아니라는 것에 한표입니다.\n잡음이 없이진 듯 하나, 소리도 같이 없어진 경우가 많다. 라는 글 다수 있어요. 스피커로 잡음이 심하게 들리지 않으면 굳이? 심리적 만족?\n허브에 대하여 일주일째 고민하다가 오디오공방 사장님께 여쭤본 내용입니다. ㅎ'], ['좋은 의견 감사드립니다! 그래서 일단은 오디오용으로 써도 좋다는 허브겸용 공유기만 한번 연결해보고 소리에 어떤 영향이 있는지  판단해볼까 합니다. ^^'], ['아날로그에서는 차폐가 독이 되는데 디지털에서는 보통 좋은 쪽으로 작용하는 것 같습니다물론 과하면 안되겠죠^^']]",2021.01.15. 11:42,스피커
601,업그레이드관련(pm6005→2500ne),"현재 앰프는 마란츠 pm6005, cd6005, 스피커는 b&W 686s2로 한 5년 잘 사용중인데요. 갑자기 뽐뿌질이 와서 앰프는 데논2500ne, 스피커는 b&w 707s2로 업글할려 하는데 분명 업그레이드가 맞겠죠? 아~ 장소는 골방이고 일단은 앰프먼저 지르려고 합니다. 오디오 선배님들의 많은 조언 부탁드립니다.","[['미리 축하드립니다~\n업글 확실하죠~^^'], ['비교 자체가 안됩니다.'], ['저의 기준에서는 큰돈이 들어가는거라 고민중이었는데 확신이 서네요. 조언 감사합니다.'], ['완전 업글이죠 ㅎㅎ미리 축하 드립니다^^'], ['2500 강추합니다~^^']]",2021.01.15. 11:28,스피커
602,300만원대 스피커를 추천해 주신다면요?,"사람마음이란게 참 그러네요. 작년 봄에 와피데일 덴톤 85구입하고 앰프는 프리마루나 evo 200사서 할부금에 헉헉대다가 이제야 좀 벗어났는데, 은근히 더 비싼 스피커 알아보고 있네요. 지금그런대로 만족하며 듣고 있는데 말입니다. 앰프는 지금 현재의 것도 저에겐 과분한거라 만족하고요. 지금 당장은 아니고 시간 좀 지나서 일이겠지만 저도 좀 더 좋은 스피커를 목표로 해보고 싶네요. 스펜더 A1이나 스펜더 A2도 탐났다가 그라함 3/5가 탐났다가, 파인오디오 F700이 탐났다가 그러고 있습니다. 질감형을 좋아하고 재즈와 클래식을 주로 듣고, 좁은 골방에서 사용할 스피커인데, 300만원대에 추천해 주실만한게 없을까요?","[['1:1채팅으로 보내드렸습니다.'], ['프로악이요~'], ['감사합니다.'], ['포칼음색이 맞다면 신품 300만원대에서는 k2 936이 올킬입니다. 다른 스피커로는 600만원대인데 인천갈비탕집  특유의 가격입니다.당연히 체급 자체가 다릅니다.'], ['제 생각에는 최고의 스피커는 최근 잘 나가는  다인 이보크30  ᆢ자금이 더 되시면 이보크50이 대박입니다ᆢ 프리마루나에  이보크면  오디오 끝입니다^^~~'], ['다인오디오의 명성은 익히 들어씁니다. 독특한 질감이 있고 저역의  양감이 좋단 말만들었는데...사용해보시니 어떠신지요?혹시 저음이 과하진 않은지요? 하긴 제가 지금쓰는 덴톤85도 저역이 작은건 아니라더군요.'], ['제가 직접 써보지는 않앗지만 오디오 평론가들이 평가가 정말 좋고요ᆢ 저는 현제 토템 쓰는데ᆢ 다인의역사와 실력은 대박같아요ᆢ'], ['좁은 방이라ᆢ  암튼 이보크 좋아요^^^'], ['포칼ᆢ 인천갈비탕집ᆢ 와ㆍ다 ᆢ 요것도 괜찬겟네요 ᆢ 거실이면 이보크인데요 ᆢ 물론 더 비싼것은 더 좋겟조 ᆢ'], ['https://music.youtube.com/watch?v=wuj1P3WZJ8A&feature=share'], ['저는 그라함을 추천 드리고 싶습니다.'], ['명성은 많이 들었어요~'], ['앰프가 300만원대 미만이라면 굳이 300만원대 스픽 안하셔도... 가정에선 좋은 선택지가 많지 싶습니다.'], ['추천부탁요 ㅎ'], ['떠오르는 브랜드는 마르탠인데 가격대가 넘어가고.. 제넬렉 쪽으로 컨설팅을 받아보심이 어떨까옹..'], ['https://youtu.be/5vhNzdeqIjg\n\ntrio가 톨보이 모델이고 duo는 북쉘프인데 천만원을 넘나드는 가격대여서 ... 200-700만원대가 젤 애매한거 같아옹(순수개인의견)'], ['자료 감사합니다'], ['https://youtu.be/JbwL17lM-uc'], ['https://link.coupang.com/re/CSHARESDP?lptag=CFM91057038&pageKey=115580390&itemId=346295764&vendorItemId=3846258498']]",2021.01.15. 10:02,스피커
603,아주 기초질문이라^^ TV 스피커 문의드립니다.,"TV를 구매 예정인대, TV 사운드를 좀 영화관에 가깝게 만들고 싶습니다.​여러가지 상상과 바램으로 알아보다 보니,TV에 사운드바를 달것인가?아니면 제네바 L을 달것인가 고민하게 되었습니다.​기초질문이라고 말씀드린 이유는...제네바가 사운드바의 역할과는 다른게 아닌가 싶어서요~^^​TV와 제네바를 연결하면 삼성이나 LG에서 나오는 번들형 사운드바보다 좋은 소리가 나나요? 나겠죠?그럼 사운바는 아예 필요 없을까요?​제네바 용도가 원래 그런게 아닌거 같아서...저의 호기심 자체가 잘못 된건가 하는 의구심이 있습니다....​사운드바는 요즘 TV사면 준다고 하니까..생각하는거고..제네바는 인테리어로 좋을거 같아서 구매 고려중입니다.​1.TV+제네바2.TV+사운드바3.TV+사운드바+제네바 ​이중에서 뭐가 좋을까요?","[['""2""번 추천 드립니다. 다만, 사운드바 종류가 많습니다. 제네바 가격 정도에서 선택 하셔야 후회가 없으리라 생각 됩니다.'], ['제네바 정도의 가격이면 사운드바가격이 상당하네요...혹시 제품 추천도 좀 드려도 될까요?'], ['티비사면 주는 사운드바는 비추합니다. 처음엔 티보소리보다 좋아서 들을만 하지만 한계가 있더라구요.ㅎㅎ'], ['av리시버에 5.1 채널로 스피커 구성하시면...'], ['사운드바 검색을 해보시면...끝판용 이라고 몇가지 모델을 이야기 하신것들이 있습니다. B&O, 젠하이져(끝판왕이 모두 팔려 국내에 없는것 같습니다),보스등등...중요한것은 시대의 흐름에 모델이 많이 변하고 있습니다. 제가 사운드바를 추천하는 것은 영상과 음성의 몰입 때문에 추천(사운드바는 TV와 쉽게 가까이 위치 시킬수 있습니다.)하는것입니다. 음악적이 요소는 어느정도 배제하구요~ 댁이 어디신지 모르지만 가까운 백화점등에 가시어 맛을 보시고 결정 하시기 바랍니다. (AV를 하다보니...느낀점입니다.)저는 구형 포칼 디멘션을 이용하고 있습니다.'], ['제네바나 사운드바만 놓는것보다는 앞뒤로 스피커 놓고 5채널을 만드는게 극장같은 사운드를 만드는건 훨씬 효과적입니다'], ['TV+제네바에다가 후방스피커를 연결할 수 있나요?'], ['우선 사용하시는 tv에 사운드출력이 어떻게 가능한지 먼저 확인해보시고 제네바와 후방 스피커를 연결 방법도 고려해보셔야합니다.(모델명 검색하셔서 입력단자 아웃단자 어떤거 있는지 확인해 보세요) 만약 다 따로 연결하려면 av리시버를 구매햐셔하는데 그 순간 선이 지저분하게 생깁니다.인테리어vs실용성을 잘 따져보셔야합니다. 저도 베오사운드 스테이지 샀다가 결국에 5.1채널로 다시 구성해서  사용중입니다']]",2021.01.15. 09:18,스피커
604,제가 스피커 날려먹은 걸까요?,안녕하세요.​b&w 603 + 파워노드2i로 잘 사용하고 있던 와중에스피커에 잡음이 끼는거 같아 스피커 바나나단자를 빼었다가 다시 끼었는데요 그 후로 소리가 나지를 않습니다...ㅠ​제가 큰 실수를 한걸까요?,"[['접촉불량 아닌지 보시죠'], ['그 정도로는 문제가 생기지 않을 것같은데 다른 스피커나, 케이블, 앰프로 교차 실험 해보세요'], ['번거롭지만 꼭 파워노드 전원 빼고 하세요.'], ['큰실수는 아닐듯합니다.그렇게 스피커들이 사망하면겁나서 오디오 못하죠'], ['앰프 온 상태에서 스피커 케이블 탈거시 보통 스피커가 잘못되지는 않고앰프 휴즈가 나가는게 일반적입니다.'], ['다들 답변 감사합니다.. 파워노드 재부팅을 해봤는데 여전히 소리가 나질 않네요..ㅠ스피커 앰프 선이 여유분이 없어서 어디가 문제인지 파악을 못하고 있습니다.'], ['좌우 케이블 바꿔서 해보지요'], ['좌우케이블 바꿔서 해봐도 마찬가지네요..제가 큰 실수를 한것 같습니다..헤드폰단자에 연결해도 헤드폰에서 소리가 안나오는걸로 봐서 아무래도 앰프가 문제인것 같습니다..ㅠ'], ['저도 그저께 앰프 전원 꺼놓은줄 알고 스케 단자 만졌다가 앰프 퓨즈 해먹었습니다순식간에 2만원 날려 먹었네요 ㅠㅠ'], ['오마이 갓 방금 소리가 돌아왔습니다.갑자기 스피커에서 퍽 하는 소리가 나더니음악이 재생되네요..앞으로 조심하면서 사용하겠습니다.모두 감사합니다'], ['다시 잘 된다고 하니 정말 다행입니다......^^'], ['오됴샵 사장님들이 케이블 갈때 앰프및 주요기기들 다 켜고 스피커 케이블이나 다른 케이블 뺐다 꼽았다 하는거 볼때마다 제 속으로 욕합니다\n\n""저러다 돌발성 서지나 쇼크가 나서 비싼 기기 출력단이 나가봐야 정신차리지""\n\n님 같은 경우는 스피커 케이블을 뺐다 꼽았다 하는 금속끼리의 마찰이 순간 강한 정전기를 일으켰고\n그 정전기가 앰프에 유입된 순간 앰프의 보호회로가 기기 보호를 위해 앰프 내부의 전원을 일시차단해서 생긴 현상입니다.\n\n이거 운 없으면 보호회로에서 차단이 안되서 기기 휴즈가 끊어지는 경우가있고 휴즈조차 차단에 실패하면 기기 회로 고장으로 직결이고 스피커 파손으로도 이어질 수 있습니다.\n\n보호회로에게 감사를 표하시고 앞으로 케이블 탈부착 할때는 무조건 꼭! \n앰프는 물른 오됴 기기들을 다 끄시고 소스기가 컴퓨터면 컴퓨터도 끄시고 작업하세요\n전원코드까지 뽑고 30초정도 대기 후 작업하시면 아주 좋구요\n\n저는 휴대폰에 연결된 헤드폰이나 이어폰 케이블을 분리할때도 휴대폰 끄고 몇 초 있다가 분리하고 휴대폰을 다시 켭니다'], ['만지기만해도 망기트린다는 황금 똥손이셨군요.\n우째든 된다니 다행입니다.'], ['켠채로 뺏다 꼇다 하면 스피커 보호 회로가 작동해서 그럴수도 있습니다.'], ['파워노드2 스피커 양쪽 제대로 연결해야만 작동되는걸로 알아요'], ['ㅡㅆㄴㄷㄴㅅㅁ']]",2021.01.15. 09:15,스피커
