,tit,body,comment,time,keyword
414,"Psb xb,  polk s20  -> b&w 607 s2 문의","psb xb 2개월째 듣고 있고요,  polk s20 궁굼해서 1개월전 구매현재 2조로 번갈아 듣고 있는데요... 여러 글 읽다 보니  b&w 지름신이 ㅠㅠ중고 구하긴 너무 힘들고요,  606은 가격부담으로 포기607은 현재 스피커 2개 + 총알 50으로 가능할듯 해서여​찬성 하시나여?  제가 만족 할까요?   조언좀요~~(앰프 마란쯔 612, 듣는 환경은 6~7평 서재고요, 거의 모든 장르 골고루 듣습니다)","[['지름신 강림하셨으면 걍 바꾸셔야 맞겠네요. 못 이깁니다요. ㅎㅎ'], ['감사합니다^^'], ['소화할 수 있는 범위 안에서 업그레이드는 항상 옳습니다.^^'], ['감사합니다~'], ['업글체감은 보통 2단게 이상이라하죠..607정도면 만족감 느끼실 듯 합니다.그런데 말입니다...607들이시면 앰프업글 욕심이 또 나실겁니다.ㅋㅋ'], ['저도 그것이 두렵네요 ㅠ 감사합니다.'], ['궁금하시면 들이셔야 두 발 뻣고 편안히 주무십니다'], ['감사합니다~'], ['아까 어느 회원님께서""고민은 배송을 늦출 뿐..."" 하시던데요 ㅎㅎ'], ['감사합니다~'], ['천천히 사세요수입원바뀌어서 착한 가격으로 나울 수도 있습니다.'], ['오호... 처음으로 다른 댓글이네여 !!!snake님 늘 답변 감사드립니다~^^'], ['업그레이드 하시고 한동안 테스트 했는데 맘에 안드시면 중고로 다시 판매 하시면 어떨까요ㅎㅎ저는 S20이랑 psb xb 보고 있는데 두 스피커 중 어느것을 선호 하시는지요?'], ['좋은 의견 감사드립니다~제 취향은 xb고요 S20은 조금 더 젊은 취향이면 좋아하실 듯해요^^'], ['의견 감사드립니다. 저도 고민하다가 결국 블루님처럼 둘다 시도해볼것 같습니다^^'], ['snake 님 빼고 다들 너무 하시네여 ㅎㅎㅎㅎㅎ  두두오 까페를 혹시 지름신이 만든것 아닐까 하는 생각이 문득 ㅠㅠ'], ['xb를 디지털앰프에 물려 TV용 스피커로 이용하려는데 어떨까요?중저음에 강점이 있는 스피커로 알구있는데 대사전달이 깨끗하게 들릴지 긍금하네요~'], ['연결하셔서 넷플릭스 음질 조은거 보시믄 영화관 느낌입니다 ㅎㅎ\n대사전달 큰 무리 없습니다 \n그런데 대사전달은 xb보다 폴크가 더 우수합니다'], ['음장감이 영화감상시에는 좋은데 뉴스볼때 벙벙거릴까봐 고민했습니다.큰 무리없다니 다행이네요~'], ['네 무리업써여 xb 조아여~^^']]",2021.04.14. 11:19,스피커
415,kef lsx 와 컴퓨터 와이파이 연결,"오린이입니다. ​카페에서 추천하는 제품중에서 kef lsx로 지르고, 컴퓨터(win 10)와 블루투스로 연결했습니다.​와이파이가 음질이 더 좋다고 하던데, 피씨와 와이파이로 연결할 수 있나요?그리고, 스피커 좌우 설정은 필요없나요?​​​","[['어떤방식으로 음원을 재생하시는지요? 조금더 자세한 정보가 있어야 고수분들이 답변해주실듯요~'], ['답변 감사합니다.음원은 유투브, 유투브 뮤직, 넷플릭스를 사용하고 있습니다.'], ['PC에 wi-fi 신호 안잡히시면 usb wi-fi 모듈 같은거 사서 꼽으시고\n스피커랑 같은 공유기에 연결해주시면 되요'], ['답변 감사합니다.현재 pc 와 공유기는 유선으로 연결되어 있네요..pc도 와이파이로 연결해야 되는군요..'], ['유선 연결 되어있으면 스피커만 와이파이 잡아서 쓰셔도 되요.\n같은 공유기에 연결 되어있으면\nDLNA 또는 PC아이튠즈 air play등 기능 사용할 수 있어요'], ['별다른 설정없이 그냥 스피커와 연결되는군요..집에 가서 시도해보겠습니다..좋은 하루 보내세요..'], ['혹시 PC와 LSX를 WIFI로 연결하는 거 성공하셨나요?성공하셨다면 동영상과 음성의 싱크는 잘 맞는지요?그리고 한 번 연결 성공하고 나면 그 이후에는 별다른 설정없어도 바로 컴과 LSX가 자동으로 연결되서 컴터 소리가 LSX로 나오는가요?'], ['wifi 연결에 실패했습니다.아이패드 미니와 lsx를 에어플레이로 연결해서 듣고 있으나, 자동으로 연결되지 않고 매번 연결해줘야 하네요.'], ['저도 궁금합니다 그래서 인터넷 검색중인데 여럿검색해보고 생각하기론 블루투스는 컴퓨터의 모든소리를 들려주고 앱 벅스 유튜브 등등 영화 등등 무선으로 컴퓨터에서 실행하는 모든소리를 무선으로 들려줌 하지만 와이파이는 dlna 지원하는 앱 벅스 타이달등 과 관련해서 재생 설정에서 기기 선택후 가능한걸로 생각이 드네요 고수님들 얘기하듯이 음질은 와이파이상에서의 음질이 더 좋지만 범용성은 블루투스가 더 좋을듯.   제 생각인데.  작성자 님도 이런 취지에서 물어보신거죠?'], ['네.. 맞습니다.다른 장치나 연결없이 블루투스처럼 한번 연결해놓으면 모든 소리가 lsx로 나오게 하고 싶었습니다.현재는 아이패드 미니에서 유투브 뮤직을 듣고 있는데, 이것도 매번 에어플레이로 스피커를 잡아줘야해서 조금 불편합니다.현재 블루투스와 wifi를 번갈아 들어보니 음질 차이가 안나는것 같습니다.그래서, 사용이 간편한 블루투스로 연결해서 사용할까 고민중에 있습니다.'], ['http://audiopub.co.kr/2020/03/22/%EB%AC%B4%EC%84%A0-dlna-%EA%B8%B0%EA%B8%B0%EC%97%90%EC%84%9C-pc-%EC%9E%AC%EC%83%9D-%EC%8A%A4%ED%8A%B8%EB%A6%AC%EB%B0%8D-%EC%9D%8C%EC%9B%90%EC%9D%84-%EB%93%A3%EB%8A%94-%EB%B0%A9%EB%B2%95%EB%A1%A0/'], ['여기에 답이 있는듯 합니다'], ['돼긴 돼는데 상당히 번거로운듯'], ['좋은 팁 감사합니다.그런데, 상당히 복잡하네요.'], ['요런것도 있네요 https://m.blog.naver.com/PostView.nhn?blogId=gns36&logNo=221140060907&proxyReferer=https:%2F%2Fm.search.naver.com%2Fsearch.naver%3Fquery%3D%25EC%25BB%25B4%25ED%2593%25A8%25ED%2584%25B0%25EC%2597%2590%25EC%2584%259C%2B%25EB%25B2%2585%25EC%258A%25A4%2B%25EC%2599%2580%25EC%259D%25B4%25ED%258C%258C%25EC%259D%25B4%2B%25EB%2593%25A3%25EA%25B8%25B0%26where%3Dm%26sm%3Dmob_hty.idx%26qdt%3D1'], ['이건 시도해볼만 하겠네요..'], ['컴퓨터와 블루투스로 연결하셨으면, 윈도우 작업표시줄에 우측에 있는 스피커 아이콘에서 컴퓨터와 연결된 스피커를 선택할 수 있습니다.']]",2021.04.14. 09:00,스피커
416,북쉘프 스피커 스탠드 고정 문의드립니다.,"올 봄 이사를 마무리하며, 작년에 사두었던 스피커 설치를 하려고 합니다.  그런데 문제가 하나 생겼네요. ;;;​TV 양측으로 야모 북쉘프 S803을 스탠드에 설치하려고합니다.   스탠드는 스피커와 동일한 화이트로 깔맞춤하려고 칸토 제품을 구매했는데... 스피커와 고정을 위해 S803 밑면을 보니 나사로 조여 고정할수 있게 되어 있지 않네요.  ​이런 경우 어떻게 해야 되나요? 경험 있으신 분들 있을까요? 밑면에 볼트 조일 수 있게 홀내서 설치할 수 있나요? 부품은 뭘 사야할지? 너트? 용어도 잘 모르겠네요...^^;;;​스탠드에 스피커 올린 사진은 고정없이 올려봤습니다. 이런 모습을 생각한건데... 고정이 문제네요. -.-","[['블루택 사서 붙이세요'], ['스피커와 맞다는면이 마지막 사진처럼 스펀지 쿠션 형태로 되어 있어서요. 스펀지를 제거해서 붙여야 되나요?'], ['덕분에 블루택 검색해서 다른 분들 글 참고하고 있습니다. 감사합니다.'], ['원래 스탠드에 단단히 조이거나 하지 않고 미끌리지 않게만 해주면 돼요. 저 쿠션이 미끌림 방지가 되어 있지 않나요? 그렇다면 그대로 쓰셔도 될 듯 해요.'], ['네. 저 쿠션이 미끌림 방지로 보입니다. \n스피커 떨어질까 고정이 필수 인지 알았는데 윗분 블루택 검색해 보니... 블루택에 올려만 두시고 사용하시는 분들도 있네요.  저는 떨어질까봐서 고정을 꼭 해야 된다고만 생각을 했습니다.  답변 감사합니다.'], ['3m 코맨드 찍찍이라고도 검색해 보시죠. 음질 면에서도 이익이 크다고도 하는데 그건 모르겠고요. 블루텍에서 그쪽으로 많이 넘어가는 중입니다.'], ['블루텍 추천해요'], ['전 스피커에 흠집 내는게 실어서 ... https://m.cafe.naver.com/ca-fe/web/cafes/28248719/articles/325293단 집에 애가 어리다면 좀 risky 할수도 ...'], ['스탠드 정보가 궁금합니다.칸토라는 제품을 검색해봐도 어렵네요저도 야모 화이트 고려 중이라 문의드립니다 :)'], ['쪽지 드렸어요!'], ['저도요~~ 검색하는데 잘안나와여 SP32PLW 혹시 이건가여? https://www.coupang.com/vp/products/4946153369?itemId=6525130195&vendorItemId=74528515596&src=1032001&spec=10305201&addtag=400&ctag=4946153369&lptag=P4946153369&itime=20211001124305&pageType=PRODUCT&pageValue=4946153369&wPcid=16176866045844797641231&wRef=cr.shopping.naver.com&wTime=20211001124305&redirect=landing&isAddedCart='], ['Kanto SP32와 SP26 두가지 있습니다.  길이 정보 보시고 구입하세요.\n저는 26 사용하고 있습니다.'], ['감사합니다람쥐^^'], ['저도 제품정보 같이부탁드려도될까요!?'], ['쪽지 드렸습니다.'], ['저도 스탠드 제품정보 알수 있을까요?'], ['Kanto SP32와 SP26 두가지 있습니다.']]",2021.04.14. 07:34,스피커
417,레가앰프와 궁합좋은 스피커,레가 앰프와 궁합이 좋은 스피커는 뭐가 있을까요?평이 좋은 레가 앰프의 성능을 잘 보여주는 스피커를 찾고 있습니다.조언부탁드려봅니다.,"[['레가 앰프가 워낙 색깔이 강해서 공간에 맞는 스피커만 잘 선택하시면 기본이상은 합니다.\n\n파케성향도 잘 받아줍니다.\n스피커와 연결후 부족한 부분만 파케로 채워주시면 만족하실겁니다^^'], ['레가앰프에는 레가스피커 원브랜드 매칭을 많이들 추천하시던데 구동력 좋아서 아주 까탈스런 스피커 아니면 두루두루 괜찮지 않나 싶습니다.']]",2021.04.14. 05:15,스피커
418,턴테이블 접지에 관한 의문?,"당연히  턴테이블은 접지를 해야 한다?라고  알고  있었습니다... 지금 까지는요...그런데 히안하게도...   스피커에세  웅 하는 소리가 나서 ,2틀째  접지, 청소 를 계속 하고 있습니다,텐테이블->앰프 접지,앰프 따로 접지,cd플레이어  접지,할수  있는 접지는 다했죠...그런데..  험이 계속  나더라구요...아날로그는 정말이지  매우  어렵네요...앰프에  손을 대면  웅~  하는 소리가    ..  웅 웅웅  웅 이런게 나더군요...턴테이블만  험이  나더라구요...그래서  턴에서-->앰프 접지를  해채 하는순간  거짓말 같이 웅 소리가 안나더라구요...​왜 다른 회원님은  접지를  안했을때 나오는 험이   저에게는  접지를  했을때  나는  걸까요?","[['집마다 전기 사정이 달라서 그런 것이 아닐까요접지를 타고 노이즈가 올라올 수도 있구요'], ['그런거일수도  있겠네요...방법은   턴과  앰프와 접지를 안하니  노이즈가  없어지더라구요 ㅎ'], ['앰프에 잔류전기가  표면에 흐르는거 아닐까요그래서 접지를 하면 앰프의 전류가 턴으로 유입되서 오히려 험이 발생하고떼면 조용하고그냥 상상입니다 저 전문가 이니에요 ㅎ'], ['앰프 접지는  따로해서... 그런거 같지는 안더라구요'], ['전에 그런 때가 있었는데, 처음엔 파워의 극성을 바꿔서 일시적으로 해결되었어요. 결국엔 톤암 내부의 선이 문제라서 선 교체로 해결했네요..'], ['톤암 내부선제는  교체를 해놓은 상태 입니다'], ['쉽지 않네요....@,@;'], ['혹시 카드리지  리드선과\n헤드쉘  접지 확인 해보셨나요?'], ['카트리지 리드선과 헤드쉘 접지 확인은  어떻게  하는건지요?'], ['암대와 헤드쉘  분리후  다시  잘  결합해보세요\n리드선은  카드리지의  네가닥 선을 말하는 겁니다\n핀셋으로  차분하게  잘 끼워졌나  확인해주세요'], ['접지 험에는 정답이 없는거 같습니다. 접지를 하든 안하든.. 험이 안뜨면 그게 정답이죠^^'], ['그게  답인거 같아요...\n접지를  안하니...  험소리가...현저히  줄더라구요 ㅎㅎ'], ['텐테이블 카트리지나 포노앰프로 유기되는 경우도 있습니다. 모든 접지가 다 되어 있는 상태 에서도.카트리지( 또는 포노앰프) 근처에 앰프나 전원트랜스가 인접해 있는경우에도 그렇습니다.거리를 이격하는 것도 검토 해보세요.'], ['아  좋은 조언 감사합니다']]",2021.04.14. 01:32,스피커
419,매장스피커 문의입니다(왕초보),현재 9평짜리 매장에서 야모803 4대를 사각에 달고 쓰고있습니다. 컴퓨터-usb사운드카드-앰프(10만원도 안하는 싸구려)-기본 케이블선- 야모803 이런식으로 되어있습니다.​앰프가 제 기억에 4채널 출력이 80w인가 그랬는데 소리가 크게는 안나는거같긴해요사운드카드도 그냥 싸구려고여케이블선은 천장으로 타놔서 지금 바꾸기엔 무리가 있어요​여기에 약 40만원대 앰프로 바꾸면 해상력이나 음질의 차이가 나올라나요? (영화는 안틀고 음악만 틀어요) 보통 매장에서 조용한 감성음악위주로 틀어서 출력보다도 해상력이 좀 나아졌으면 합니다. 그리고 사운드카드도 dac으로 바꿔야 될까요 아니면 10만원짜리 사운드카드 있는데 그걸로 바꾸면 될까요?​,"[['앰프 찾았습니다! 그리고 저기 1채널이라고 되있는데 이건 따로 스테레오나 이런 공간분리가 안되는건가요?'], ['1채널이라는 의미가 스피커 개별 볼륨 조절이 안되고 한꺼번에 연결한 스피커 볼륨이 커지고 작아진다는 의미입니다'], ['그러면 공간감은 4채널은 맞다는건가요??'], ['매장에서 해상력 올리시려면 앰프 출력이 200w 이상은 되야 원하시는 해성력이 나오지 않을까요?'], ['출력이 높아야 해상력이 올라가는거였나요?? 그럼 역시 앰프를 바꾸면 효과가 있긴 하겟네요'], ['해상도를 높일 수 있는 콤포넌트들의 효과들이 여럿 있습니다. 그러나 매장에서 사용하시는데 80와트 출력이 쓰시는 스피커로 좋은 해상도를 얻기에는 충분하지 않다고 생각이 들어요. 그리고 매장들은 특별히 사운드를 고려한 배치가 아니라서 소리 난반사가 많거나 울릴 가능성이 클거라 예상합니다. \n그만큼 스피커의 스펙에 맞춘 앰프 출력이 해상도를 좌우하겠죠. 해상도가 더 좋은 스피커를 쓴다면 또 다른 이야기겠지만 스피커를 고정 요소라고 고려한다면 앰프 출력이 바뀌면 해상도가 바뀌고, 아니면 소스기기가 해상도를 바꾸는 요인이 되겠습니다.'], ['앗 감사합니다 그리고 제 스피커 출력이 cont/peak 80/160이라고 되어있고 앰프가 채널당 130이라고 되있으면 괜찮은 매칭일라나요? 입문이라 막장만 아니면 될거같은데 지금앰프는 좀 막장같네요 ㅠㅠ'], ['무슨 앰프인지는 모르지만 출력만 보았을 때는 충분해야죠. 매장에서는 컴퓨터로 연결하실거면 그냥 옵티컬로 출력 가능한 인티앰프(티악 정도?)만 되어도 나아지실 거 같네요. \n컴터->인티앰프->스피커'], ['감사합니다~! 충분히 도움이 된 것 같습니다'], ['조금이라도 도움이 되셨으면 다행입니다 ㅎ']]",2021.04.14. 00:55,스피커
420,업그레이드 질문,생각과 고민만 하다가 최근 책상파이로 마련했습니다.​앰프 : 인켈 AX 3200Q dac : topping dx3 pro Ldac스피커 : psb xb​입니다. 앰프는 오래된 건데 최근 모델이름을 알게되었습니다.ㅎㅎ 다른 글 보니 옛날꺼지만 파워는 좋다고 하시더라구요​이렇게 사용하다가 아무래도 업그레이드 생각이 자꾸 들어서 제일 오래된 앰프부터 바꿀 생각입니다. ​다음 앰프를 m-one으로 생각하고 있는데 더 상위모델로 가야할까요? 아니면 적당히 올리고 dac을 바꿔야할까요?​스피커는 가성비도 좋고 지금 너무 맘에 들어서 나중에 바꿀 예정입니다​,"[['PSB XB는 앰프 좋은 것으로 바꿀수록 소리가 많이 좋아집니다. M-ONE과는 테스트해보지 않아서 모르겠지만, 오래 즐기세요. 정말 좋은 스피커입니다. 지금 혹시나 하는 마음에 3배 비싼 것을 샀다가 후회의 눈물 흘리고 있습니다.'], ['앰프를 바꾸고 싶은 욕심이 엄청나게 생기네요.. 조금만..더 좋은..거 더좋은거 찾게되네요 ㅎㅎ참고해서 스피커는 한동안 계속 써야겠어요 !!']]",2021.04.14. 00:48,스피커
421,온쿄 스피커 질문이요,혹시 이제품에 대해 아시는분 설명이나 사용기좀 부탁드려봅니다,"[['일본에서 중고가 1만엔 초중반에 팔리는 스피커네요. 그걸 사서 한국에 오면 딱 두배 듭니다^^; 사실 저도 일본에서 직구로 그런 스피커 하나 사봤거든요. 그냥 한국에서 중고가 30만원짜리 사는게 훨 맘편할 것 같아요.'], ['그런거 어디서볼수있나요? 싸이트나 링크좀 부탁드려요~~*^'], ['일본 직구 사이트 검색하시면 많이 나와요. 전 온재팬 통해서 구매했어요.']]",2021.04.13. 23:48,스피커
422,음감용 폰은 어떤게 적당할까요?,"저의 음감 시스템으로는 LG 휴대폰 정도면 훌륭할 것 같아,​먼저 휴대폰으로 들어보려합니다. ^^;​V20 30 40 50G6 7 8​정도를 추천하시는것 같던데....​중고로 하나 구매하려면 어느놈을 사는게 나을까요?​사실 V20 액정 깨진놈이 하나 있긴한데...​액정 깨진게 영 보기 좋지않아 가능하면 하나 새로 구매할까합니다.​​참고로, B&O 하이파이플러스 DAC도 가지고 있습니다 ㅎㅎ​고견에 미리 감사드립니다. ^^","[['LG G5의 액서서리었던 하이파이플러스 DAC경우\n퀴드가 아닌 트윈, 더블 DAC칩이구요\n\n이후 모델들은 전부 ESS사의 콰트로칩입니다.\n\nV20,30 , G6는 B&O협업이라 \n북유럽감성의 냉정하면서도 섬세한소리에 \nLG가 저음도 추가하여 아주 좋습니다.\n\nV35, G7은 LG자체 튜닝으로 협업은 없구요.\n\nV40,50, G8부터는 메르디안협업이라 메르디안음색입니다.'], ['매번 LG폰 거론하시더니 역쉬 빠삭하시군요'], ['힝....\n사업을 접었다니...이런 나를 두고...ㅠㅠ'], ['오.... 감사합니다. 말씀하시는 뉘앙스로는 20 30 쪽을 조금 더 좋게 생각하시는것 같은데, 맞나용?'], [''], ['취향차이입니다~^^\n제가 차갑고 섬세한음색을 좋아라하다보니~ㅎㅎㅎ'], ['v20 30 간의 차이는 미미하겠죠? 액정 깨진 20이라도 있으니, 40을 한 번 들여보고 선택할까해서요^^;'], ['20, 30의 차이는 \n이어폰의 좌우볼륨을 각각조절 할 수 있다는것과 \n배터리가 분리형이냐, 일체형이냐의 차이입니다.\n\nV20있으시다니 V40,50과 매장등에서 비교하시면 딱이죠~!!!'], ['오... 감사합니다!'], ['아! 김형석님. \n제가 SMSL M200 DAC를 구매해서 배송중인데... \n\n폰(V20 OR 40) - DAC(SMSL M200) - 8010\n\n폰 - DAC : AUX\nDAC - 8010 : XLR\n\n이렇게 들으면...\n\n폰 소스가 의미가 없나요?^^;,'], ['LG핸드폰에서 3.5 이어폰단자를 활용하지 않으면 즉 USB, 블루투스연결시에는 하이파이 콰트로 DAC가 작동하지 않습니다.\n\nDAC가아닌 소스기로서만 사용되는겁니다~^^'], ['저는 사무실에서 책상파이하느라 LG폰 V40 -(무저항잭 -3.5파이 -XLR 케이블) 8010aw 해서음원과 타이달로 듣는데 소리가 좋네요.사정상 스피커가 큰것은 설치가 곤란해서요...']]",2021.04.13. 22:29,스피커
423,데스크파이 소형 스피커 어떤 게 좋을까요?,"안녕하세요? 작년 여름에 오디오 처음 입문한 오린이입니다.현재 데스크파이로 마란츠 cr-612에 마그낫 시그니처 503 사용 중인데요,책상이 좁기도 하고ㅠㅠ 방도 크지 않아서 좀 더 작은 스피커로 바꾸고 싶더라고요.대강 알아보니 큐어쿠스틱 3020이나 마그낫 에델스타인 많이 쓰시던데,현재 사용 중인 마그낫 시그니처 503보다 음질이 덜할 것 같아서.. 고민이 됩니다.책상 위에서 가볍게 사용할 아담한 소형 스피커 추천해주실 수 있을까요?예산은 60~100 생각하고 있습니다. 미리 고맙습니다!","[['카시오페아 tt, 피에가 tmicro3, 웨이버사의 s1, nht superzero, 사운드포럼의 포도, 멜론, 오렌지 등이 있습니다.'], ['오 추천 고맙습니다 찾아보니 피에가가 가장 땡기네요!!'], ['저도 사용중입니다.   :)'], ['토핑하고 아이라우드로 종결 했습니다.'], ['추천 고맙습니다 앙증맞고 딱 좋은 사이즈네요! 사운드도 괜찮은가요?'], ['Kef lsx도 생각해 보세요^^'], ['디자인도 예쁘고 이래저래 다 마음에 드는데 액티브 스피커네요?! 올인원 마란츠 CR-612와 연결해서 사용해도 문제 없을까요? 오린이라 초보적인 질문 죄송합니다ㅜㅜ'], ['작은사이즈눈피에가 넘좋더라구요 크기는작은데  큰스피커서듣는 느낌 좁은공간에선최고인것같어요'], ['네 책상이 좁아서 올려두기 딱 좋을 것 같아요 작은 사이즈인데 좋은 사운드가 난다니 너무 궁금합니다'], ['마그낫 시그니처 503을 책상에 올려놓으실 정도면 에델스타인 추천 안드려요. 일단 우퍼사이즈가 너무 차이가 납니다. (6.5 vs 4.5)  제 생각으로는 5.25인치 급 우퍼 스피커로 확실한 업그레이드로 가시길 바랍니다. 책상위에 마그낫 같은 6.5인치 우퍼 스피커는 정말 부담되지요. 전 에델스타인 소리에 대해 어느정도는 만족은 했는대 4.5인치 우퍼의 어쩔수 없는 한계들로 인해 며칠 사용하고 귀양보냈어요. 전 중고로 5.25인치 우퍼 다인 X12 구해서 PCFI 듣고 있어요. 크기 503보다 훨씬 작습니다. 두서없이 그냥 적어봤네요. ㅎㅎ']]",2021.04.13. 22:22,스피커
424,부밍 방지 패브릭 위치 바닥,부밍을 조금 잡아보려고 패브릭 판낼을 알아보고 있습니다. 듬성듬성 9장 정도를 벽에 부착하려고 하는데다른 분들 시공한 형태를 보면 바닥에는 잘 안붙이시고1미터정도 위로 띄워서 붙인경우가 많은것 같은데바닥에 붙이면 효과가 떨어지거나 않좋은가요?아니면 스피커 모양에 따라 갈까요?,[],2021.04.13. 22:19,스피커
425,음질 노이즈 관련 질문드립니다,안녕하세요 선배님들 ​pc 스피커 넷플릭스로 영화보다 한 4초정도 장작타는것같은 노이즈가 나와서 ​그 구간 반복해도 계속 같은 노이즈길래 .. 젠하이저 무선 헤드폰으로 pc랑 무선연결해도 그 구간에 ​노이즈가 나오면 제 스피커가 아니라 영상이 문제인게 맞겠지요?​감사합니다^^,"[['당연하죠 ㅎㅎ 걱정마셔요'], ['감사합니다^^;; 입문 오린이다보니 이쪽 지식이 너무 방대해서 괜시리 겁먹게되네요']]",2021.04.13. 21:37,스피커
426,네트워크플레이어? 선택고민,"안녕하세요.​클립쉬더식스 액티브스피커사용하다가(휴대폰블루투스, cd,lp조합)마란츠 pm8006에 KEF Q750 조합으로 새롭게 거실을 구성했습니다. 휴대폰이나 패드로 듣고싶은데 네트워크플레이어가 없어불편해서 알아보려구요.로즈201A나 파워노드2i를 많이들 추천하시는데pm8006이랑 로즈나 파워노드 조합이 가능한건지요?로즈나 파워노드를 앰프에 rca케이블로 연결만 하면 되는거지요?​로즈가 화면이 있어 좀 간지나보이고 파워노드2i도 음질이 좋다고하셔서어떤걸 해야할지 고민됩니다.전문가분들 조언좀 부탁드려요~​예산땜에 중고로 알아보려구요 ㅠㅠ","[['파워노드는앰프포함이라 더저렴한 노드로구하심되요 화면이필요하시면 로즈  음 악만들으심  노드요 파워노드사시면 지금 앰프랑조합이 안됩니다'], ['네 파워노드는 앰프군요....노드2i가 네트워크플레이어인거죠?'], ['네맞습니다 파워노드는앰프일체형네트워크플레이어인데프리아웃이없어서다른앰프를못써요'], ['네 감사합니다. 로즈나 노드 음질차이는 없을까요?'], ['중고가격차가두배라 노드먼저써보세요 다시팔아도 손해없으실거에요'], ['소리샾에중고나왓네요그거사심되겠네요'], ['네 감사합니다']]",2021.04.13. 21:34,스피커
427,오디오테크니카 턴테이블 스피커 질문,안녕하세요 오디오테크니카 60x bt 제품 주문했는데 스피커를 아직 못 정했어요ㅠㅠ,[],2021.04.13. 21:29,스피커
