,tit,body,comment,time,keyword
200,"kef ls50 wireless 2 사려고 고민중인데요, pc와 연결 방법이 있을까요?","usb 입력단이 사라지고 디지털 동축, 광입력이 있습니다.​아쉽네요. ㅠ 디지털동축 케이블을 pc와 연결할 방법이 있을까요?​ls50의 내장앰프와dac모두 쓸수있게 디지털연결이 가능해야 하고, 볼륨조절은 기존 usb처럼 윈도우에서 되는 방법이 없겟죠? ㅠ","[['ddc이용하면됩니다'], ['pc 연결 할 필요가 굳이 없는 스피컨데요.  PC연결하려면 ddc사시면 되기야 하지만 그러면 다른 선택을 하시는것도 어떨지요?'], ['방법 알려주세요.'], ['스피커에 네트워크 플레이어가 내장되어 있어서 웬만한건 다 되어요. TV랑 HDMI케이블 연결 되니 TV사운드 들을 수 있고요. 그럼 대충 다 되는거 아닙니까.'], ['PC 스피커로 쓰고 싶단 얘기죠. DDC 말고 방법이 있을까요?장비 자꾸 사기 싫은데 ㅜㅜ'], ['에어플레이,hdmi,usb 요 세개만 다 지원되면 좋겠는데요. 포메이션듀오2하려다 hdmi없어서 ls50으로 내려왓는데 usb가 아쉽네요 ㅎㅎ'], ['그러게요 usb 가 없어서요. ㅠㅠ'], ['저도 usb단자 때문에 wireless 구버전이랑  ls50 meta 고민하다가 그냥 패시브스피커로 구매했습니다.'], ['룬(roon)을 플레이어로 사용하시면 됩니다.같은 네트워크 단에 있다면(일반적인 집 무선공유기와 연결되면 같은 네트워크 단 입니다)PC또는 NAS에 저장된 음원을 무선으로 전송하여 플레이가 됩니다.제가 LS50 W 버전으로 사용을 했습니다.*** 단 LS50 W2 가 아직  Roon ready 인증 진행중으로 알고 있습니다.'], ['usb연결이 안된다면 이게 제일 깔끔한 방법 같네요 ㅎ 룬이 근데 아직 유료죠? 인증완료 안되고 출시부터 햇을까요 어려운일이 아닌것 같은데 흠.. ㅎㅎ 아쉽군요~'], ['룬은 한달씩 사용료를 내셔야 합니다.아래 링크에 보시면 한달씩 결재와 1년단위 결재에 따라 금액 차이가 있습니다.장점은 보유한 음원 파일, 타이달, 코브즈, 스포티파이의 계정을 연결해서 통합 플레이리스트를 만들고 사용할 수 있습니다.https://roonlabs.com/pricing'], ['룬을 사용해도 컴퓨터의 스피커로는 사용이 안되지요. 내장 사운드 카드에서 광출력을 ls50으로 입력하면 되겠네요. \n\n광입력이 두개 이상 필요하면 알리등에서 광을 광+동축으로 나눠주는 작은 분배기사서 나누면 되겠습니다.'], [''], ['룬에서 출력을 LS50 W 또는 피시에 연결된 DAC 아니며 기본 출력을 선택할수 있습니다.굳이 내장 사운드카드를 광출력으로 LS50 W에 연결할 이유가 없습니다.'], ['저도 룬을 사용하고 있습니다. 그래서 룬으로 음악들을때 말고 일반 pc의 게임이나 동영상을 보기 위해 필요한 것을 말씀 드린겁니다.\n\n음악을 들을땬 룬을 켜서 말씀 하신것 처럼 들으면 되고. 음악 말고 다른것을 할때는 광을 쓰면 됩니다.'], ['게임과 동영상을 말씀하시는 거였군요. ^^ 딴지는 아니었습니다.. 에어플레이와 크롬캐스트가 지원되니 오디오 출력을 두 무선 기술을 이용하여 이용하시는 방법도 한번 고려해보시는 것도 나쁘지 않을 것 같습니다..']]",2021.01.13. 14:43,스피커
201,데스크&pc-fi 추천 부탁드려봅니다(사무실 책상 위에서 구성하려 합니다),"안녕하세요.음악 듣는 게 거의 유일한 취미라 두두오에서 정말 많은 도움 얻고 있습니다^^제가 음악 듣는 환경이 좀 특이해서 선택지가 별로 없을까 싶은데요,​1. 사무실이고 책상에서 pc를 이용해 타이달이나 음원 등으로 듣습니다.2. 제 일이 상담하는 일이라 제 책상 건너편에는 다른 분이 앉는 의자가 있고, 중간에 쉴 때 주로 음악을 듣습니다.3. 저와 스피커의 거리는 60cm 정도, 스피커 간의 너비는 바깥쪽 기준으로 55cm 정도밖에 안 됩니다.(스피커를 저한테서 더 멀리 두거나, 간격을 벌리면 손님 바로 앞에 떡하니 스피커가 놓여 버립니다^^;)4. 지금은 오디오엔진 A2+ BT를 듣는데 이게 모니터 아래쪽에 딱 들어갑니다. 스피커가 이보다 높아지면 모니터 뒤에 놓아야 하는데 만약 30cm 정도 높이의 스피커라면 트위터는 모니터 뒤에 가려져서 거의 안 보이는 상태가 됩니다^^;5. 사무실 중간에 책상이 있기 때문에 스피커 뒤에서 벽까지는 거의 3미터가 넘습니다.​이러다 보니 보통의 북셀프 스피커 너비가 20cm 정도는 될 텐데 그렇게 하면 양쪽 스피커 사이가 15cm밖에 안 되고 저는 그걸 60cm 거리에서 듣는 셈이구요.구조상 스피커 스탠드 써 가며 벽에 가깝게 하기는 좀 과하고 결국 극니어필드의 데스크파이 구성을 고민하는 셈입니다. 오디오엔진 A2+ BT를 몇 달 들었는데 더 좋게 듣고 싶은 욕심이 생겨서요^^​1. 음악은 주로 클래식, 재즈를 듣고 가요나 팝은 거의 안 듣습니다.2. 음색은 피아노의 맑고 영롱한 소리, 화사하고 밝은 음색이 마음에 들구요.3. 좁은 공간이지만 피아노는 이쪽, 바이올린은 이쪽에 있구나 같은 게 느껴지면 훨씬 재미있게 들리구요. 4. 가격대는 신품가 기준으로 6-70만원 정도로 생각하고 있습니다.(중고는 마냥 하염없이 기다리는 게 어려울 것 같네요^^;)​여기서 검색을 꽤 많이 했는데 지금 쓰는 오디오엔진이나 iloud mm, sc203 등이 추천되더라구요.(제네렉은 너무 고가인 듯 하여 제외했습니다^^;)그 외에 추천되는 아담 t5v는 사이즈를 보니 꽤 커서 어렵겠더라구요.패시브 스피커는 큐어쿠스틱 3010i가 좀 작고 달리 젠서1, 마그낫 에델스타인 정도 크기까지가 마지노선인 듯 한데 패시브는 또 앰프를 알아봐야 하는 어려움이 있구요.​쓰다 보니 결국 sc203이 종착지인가 싶은데 제가 듣는 음악 성향이나 원하는 방향이 딱히 모니터링 스피커 쪽은 아닌 것 같아서 혹시 이 정도 가격대나 더 저렴한 가격으로 앰프+패시브 조합이 더 나은 선택지일까 싶어 이렇게 문의 드립니다. 회원분들의 조언 부탁드리겠습니다. 감사합니다.","[['개인적으로 큐어쿠스틱 3010에 올인원앰프 물려서 쓰는게 데스크파이에선 가장 좋은 선택이 아닐까 싶습니다.'], ['조언 주셔서 감사합니다. 참고하여 열심히 알아보겠습니다~']]",2021.01.13. 14:03,스피커
202,카나레 rca y선 불량?..,턴테이블과 보스미니스피커를 연결했어요. 지이이잉 소리가 나네요전류 흐르는거처럼요 ㅠ 뭘까요..?,"[['phono 내장 턴인가요?'], ['넵! 맞아요'], ['그걸 on이 아니라 thru로 해놔야할까요??'], ['on에 하시고 접지 를 해야 할겁니다'], ['보스미니는 aux라서 접지하는곳이 없는데요...? ㅠㅠ'], ['그래서 그럴겁니다 다른것에 접지해 보세요'], ['ㅠㅠㅠㅠ 스피커를 바꿔야 한단 말씀이신가요?? 접지 가능한 스피커요..? 아님 다른곳애 접지할곳이 있을까요'], ['접지를요 다른곳에 해보세요'], ['턴테이블 접지단을 멀티탭 접지단 같은곳에 연결 해보세요.접지단 있는 스피커는 없습니다.'], ['아...!! 감사합니다! 하ㄴ번 해보께요!']]",2021.01.13. 13:08,스피커
203,"포칼 소프라1, 2, 3의 적정 중고가격이 얼마쯤일까요?","와*다에서 워낙 싸게 풀린 탓에 가성비 뛰어난 스피커가 되어버린 느낌?​상태에 따라 다르겠지만,소프라 1의 대략 400중후반인 거 같고,​그럼, 2, 3가 상태 좋다면 가격은 얼마정도 할까요?​총알 좀 모으던지, 생각지 못한 돈이 생기면 장만하게요..ㅎㅎㅎ​와*다에서 싸게 풀지 않았다면 접근도 못할 스피커들인데,싸게 신품을 팔다보니,덩달아 중고가까지 많이 낮아져 접근하기 어렵지 않은 스피커인 거 같네요.​소리도 당연히 좋을 것이고.....","[['2가600~700 3가 1000~1100 \n\n전그래서 3 갈비탕집에서 신품 구입'], ['3가 갈비탕집에서 얼마인가요? 15,840,000원으로 나옵니다.'], ['와싸다에\n전화하면 친절하게 가격 정리해주실겁니다^^'], ['2..3  잠깐 엄청 싸게 풀렸었었죠..ㅜㅜ'], ['그때 그가격이 얼마였나요?  ㅎㅎ'], ['좀전에 긴 글이 있었는데...삭제하셨나요? 볼려고 들어왔는데 안보입니다..'], ['아뇹..ㅎ\n긴 글 안썼었습니다..^^'], ['아~~ 다른 분이 쓰신 거 같아요..'], ['가격은 말씀 드리기가..\n아뭏튼 엄청 저렴했었습니다.'], ['와*다가 혹시 어디인가요?^^;; 초보라'], ['와싸다닷컴 입니다~~'], ['답변 감사드립니다 ^^'], ['갈비탕집은 어디인가요? ^^'], ['와싸다요^^'], ['왜 갈비탕집이에요?'], ['왜 갈비탕집이에요?'], ['아랫층에 갈비탕집이 있는데 매장 방문하면 갈비탕 식권을 자주 줘요. 그래서 갈비탕집으로 통합니다.'], ['가격. 몇백씩 왔다갔다합니다.발품안팔면 호구되는거 순식간인거 같더군요.저도 한 10년간 바꿈질없다 몇년전부터 바꿈질시작했는데초반에 정말 호구인증 ㅠ.ㅠ 했습니다..'], ['그럴 거 같아요.. 가격이 뚝뚝 떨어지니깐요..'], ['www.wassada.com 인천 만수동에 있습니다.. 1층이 갈빗집 이죠...']]",2021.01.13. 13:04,스피커
204,매장용 스피커 추천 부탁드려요ㅜㅜ!!,안녕하세요! 코로나때문에 다들 힘드시죠ㅜㅜ..!​이런 상황에서 식당을 곧 오픈하게 되는 상황입니다..ㅜㅜ​마땅히 괜찮은 스피커를 찾을 수가 없어서 이렇게 글을 쓰게 됩니다!!​25평 정도 되는 공간에서 음질 좋은 스피커를 찾고있습니다! ​인테리어에 맞춰서 쓰고싶은데 흰색 계열에 스피커를 찾고있습니다!​선이 너무 많으면 지저분해보일거같아서 ​블루투스 스피커 쪽으로 생각하고 있는데요!!​너무 고가 브랜드는 조금 부담이 될 거 같습니다..!​예산은 최대 150정도 생각하고 있습니다!​정말 강추 하시는 제품이라면 고가의 제품도 한번 고려해보겠습니다!!​다들 안전한 겨울 보내시고 코로나 조심하세요!!!​추천 부탁드립니다!!^^,"[['25평 정도고 블루투스에 하얀색배경과 어울리는 디자인이면.. 마샬이 가장 좋을 듯 한데 가격이 좀 나가서요 ㅠ'], ['아 150정도 생각하시면 마샬보다 훨씬 더 좋은 제품 있겠네요 ㅎㅎ'], ['더식스는어떨까요?'], ['KEF lax 추천 드립니다!'], ['큐어쿠스틱 화이트 스피커가 예뻤습니다. 가성비 좋게 엘탁스모니터3 사고 엠프에 힘을줘도 좋겠네요.'], ['선은 최대한 숨기고 ""흰색 콘트롤1x"" 두 조를 추천.'], ['뮤조 Qb２나  좀 더쓰시고 뮤조2']]",2021.01.13. 13:02,스피커
205,NAD c338  vs Naim Atom -- 오린이 질문드립니다 ^^,안녕하세요입문을 준비하는 오린이입니다. ^^​올인원 제품을 알아보던중 Naim Atom + Focal chora 816 조합을 봤는데 좋아보였으나 입문하는 저로서는 가격이 너무 높았습니다 ㅠㅠ​NAD 제품이 bluOS 등 사용편의성이나 음질도 괜찮다는 지인의 추천을 받아 비교적 가격이 저렴한 c338 모델을 생각중인데 Naim Atom에 비해서 출력이나 편의성도 부족하지 않은 것처럼 보이는데 실제로는 어떤지 고견을 여쭙고자 합니다.​아울러 NAD c338과 궁합좋은 톨보이(거실용) 스피커 있으시면 추천도 부탁드립니다 ^^,"[['예산이 부족하면 아톰은 비추이고 338도 성능때문에 비추입니다.마란츠 PM-7000N이 적당한 성능과 105만원이어서 가장 좋은 선택일겁니다. 왓하이파이 최고의 네트워크 앰프 중 하나입니다.'], ['네 감사합니다 ^^'], ['혹시나 싶어서 338 성능은 816을 울리기에 부족하다는 뜻입니다.'], ['네 혹시 마란츠 PM-7000N에 어울리는 가성비좋은 스피커 있으면 추천 부탁드립니다 ^^;'], ['가성비 올킬은 psb x2t가 있는데 국내가격이 75만원 밖에 안하고 코라보다 중저음은 압도하고 고음은 약합니다. 디자인은 코라가 훨씬 좋고요. 그래서 입문용 톨보이로는 x2t가 가장 많이 팔린 것으로 압니다. https://www.crutchfield.com/p_091C816BK/Focal-Chora-816-Black.html  코라 1800달러https://www.crutchfield.com/p_760IMNX2T/PSB-Imagine-X2T.html psb 1400달러 팝, 락, ost는 psb가 더 좋은 소리를 들려줍니다.참고로 포칼 빠이고 집에 포칼만 4종을 사용 중입니다. 1008be부터 스텔라유토피아까지 사용 중입니다.'], ['http://blog.daum.net/uesgi2003/1559 pm-7000n은 왓하이파이가 플라스틱 단자만 단점으로 지적했을 정도로 잘 만들었습니다.'], ['저도 전문가는 아닌데, 톨보이는 엠프가 출력이 좀 되야 할듯요. 338, 아톰은 둘다 출력이 적어서... powernode 2i 보셨어요? 톨보이에도 많이 사용하고 심지어 816에 묶어파는데도 있던데, 실효출력 60W 정도됩니다. 저도 사용중인데 북쉘프에 보통 25%를 올리질 못하네요. 벅스와 타아달 사용중인데, 타이달 MQA 을 사용하기엔 제일 편한제품인듯.'], ['네 감사합니다 ^^'], ['참고로 c338엔 블루오스 모듈 설치가 안돼요. 기기에 내장된 크로캐스트오디오 사용하셔야 합니다'], ['단순하게 네임 무조나 예산을 좀 더 투입하여 Kef wireless로 가심이..']]",2021.01.13. 12:01,스피커
206,크롬캐스트 오디오 질문,"안녕하세요​크롬캐스트 관련해서 궁금한게 있어서 그런데요​핸드폰 -(와이파이연결) - 크롬캐스트 오디오 -(각대원연결, 외장 DAC에 opt로 입력)- 외장 DAC - 앰프 - 스피커​연결시​크롬캐스트 오디오 내장 DAC을 사용하는 것인가요​아니면 외장 DAC의 DAC을 사용하는 것인가요?","[['광연결은 외장DAC을 사용하는겁니다.'], ['외장 DAC에 opt로 입력해주면 크롬캐스트 dac 거치지 않고 외장 dac 사용한다는 말씀이시지요? 감사합니다.'], ['광출력이니 말그대로 데이터를 광케이블 통해서 외부 dac로 출력해주는 역할만 하는거죠. 데이터의 해석과 아날로그 출력은 외부dac가 담당하고요.'], ['감사합니다! 외장 DAC을 사용하고 싶었는데 저렇게 연결하면 되겠네요!'], ['네 저도 그렇게 사용하고 있습니다^^'], ['넵 감사합니다. 하나 더 궁금한게요 만약 크롬캐스트 오디오를 각대원으로 앰프에 광으로 연결하면 이 경우에는 앰프 자체 dac을 사용하는 것인가요? 아니면 크롬캐스트 dac인가요? 앰프는 마란츠 pm6006입니다.'], ['제가 그렇게 쓰고 있는데요, 그렇게 하면 크롬캐스트에서 디지털 신호가 나가서 앰프 DAC가 아날로그 신호로 바꾸게 됩니다. 반면 크롬캐스트오디오를 앰프에 광연결이 아닌 아날로그 단에 연결하면 (Aux 단자 등) 크롬캐스트오디오의 DAC가 작동해서 아날로그로 바뀐 신호가 앰프로 들어가게 됩니다.'], ['감사합니다. 인생초딩님 이제 완벽히 이해가 되었어요!~'], ['추가로 핸드폰에서 크롬캐스트 오디오로 보내고 받는 한계가 24bit / 48kHz(?) 정도 되는 걸로 알고 있습니다']]",2021.01.13. 11:36,스피커
207,바쿤프리앰프중 저역이 가장 깊게 떨어지는 제품이 뭘까요?,"갈수록 바쿤 프리와 파워가 좋다고 감탄하는중입니다.​꽤 준수한 구동력과 밀도감에 따뜻한 음색, 그리고 적당한 질감에 해상력...거기에 매끄럽고 화려한 고역에 풍성한 저역과 잔향까지..........​하이엔드성향이나 음장감 위주가 아닌 진공관에 가까운 TR이 필요한 사람에겐 정말 훌륭한 앰프네요..​현재 1007 1001 레벤300xs로 책상파이는 정리했고​거실은 atc sia2-150 과 프리마루나evo400로 정리했습니다.​거실에 바쿤을 놓을까 고민중인데​중간에 7시리즈mk3 를 써봤는데 1007+1001에 케이블을 조합하니 큰차이를 못느껴 방출한적이 있습니다.​​제생각은 1. 바쿤 프리중 저역 깊이감이 출중한 녀석을 마련하여 이리저리 활용한다.(앰프가 많으므로...)​2.그냥 바쿤 파워하나를 더 마련한다 입니다. 이경우는 프리가 필요하면 1007이나 가벼운 프리를 맞추고 케이블을 좀 도합랄 생각입니다.​​혹시 두두오님들께서는 어찌 생각하시는지요?1,2번에 적당한 파워와 프리 추천 부탁드립니다..​​참..ㅜㅜ 스피커는거실에서는 탄노이 데본, atc50신형을 쓰고 있습니다.​","[['앰프가 많으시다면 5시리즈 프리 추천드려요~5430 쓰는데 좋습니다. 5시리즈중 가장 저렴하지만 괜찮은 것 같습니다.'], ['아.. 감사합니다. 찾아보겠습니다.'], ['5521 btl 추천 드립니다.'], ['모노파워앰프이지요? 감사합니다'], ['어디까지나 개인적인 경험입니다~!!!1.바쿤기준으로 저역의 깊이는 프리보다는 파워의 영향을 더 많이 받았습니다.바쿤파워는 상급기로 올라갈수록 저역의 깊이가 느껴졌습니다.굳이 저역이 인상적인 프리라면 예전 구형 5410mk2가 저역의 힘이 굉장히 좋고 음들이 아래로 가라앉지만 ... 5410mk3나 5440대비 무대가 좁고 고역이 조금 같혀있는 느낌이 들었습니다2.어느정도 높은급의 바쿤파워를 사용하신다면 1007로는 아쉽습니다. 제가 pc파이로 사용하는 7500k같은 경우에 1007과 5430을 번갈아보면서 들어보는중인데 전체적으로 차이가 꽤 많이 납니다. 지금 사용하시는 시스템에서 atc50은  5로시작하는 파워,프리는 연결하셔야 할듯합니다. '], ['역시! 별내박훈마니아 십니다'], ['포천바쿤님의 계보를 이어가고 있습니다 ㅎㅎㅎ'], ['감사합니다. 생각이 좀 많아지긴했는데....5430 또는 7610mk3 를 써보기로 굳혔습니다.\n\n많은 경험을 나누어주시는 두두오 형님들께 항상 감사드립니다.'], ['안녕하세요~\n한가하실 때 제 질문글 한번만 봐주실 수 있으실까여!!'], ['바쿤  끝판가실듯,,,, 아쉬운대로 7시리즈 라도 써보세요\n1시리즈는 정말 좋긴한데 업글하고 싶긴하져,,0']]",2021.01.13. 10:28,스피커
208,우퍼업글?인티엠프업글? 어떤것이 먼저일까요?,안녕하세요​뚱보삼입니다...​카오디오하던버릇을버리지못하고...​애잔한발라드의저역​또는구~~~~~~우우우우우우~~~~웅~~~~~~~~~~~~~그~~~~~~~~~~~으으으으~~~~~~응~~~~​거리는영화속뱃고동소리​이런소리를못버리기에...우퍼는있어야겠고​인티엠프는데논을쓰고싶은데...​1600ne2500ne는​우퍼출력이 없고.... ​리시버는또가기싫고....​갈곳은​pma-150h...​우리카페회원님들께서​저라면​무엇을먼저업글하실런지???​즐점하시고요​앗!!~~​ps.패시브 스피커는 포칼쪽으로 갈예정입니다,"[['하이파이 인티앰프를 av용으로 쓰시면 대사전달이 쉽지 않으실텐데요. av와 하이파이는 분리하시는게 좋습니다~ 북쉘프를 포칼로 업글하신다면 인티 업글이 시급해보이긴 하네요.'], ['아~고뤠요????대사는 아직 잘 들리는데.....제가골방파이~(3평)침대파이....라..그런가???알겠습니다!!!인티엠프 업글!!답변감사합니다^^즐점하세요~'], ['데논 상위급 - 7.1 나오는 리시버로 가시면 모두 해결되실듯.  하기가 귀찮아서 그렇지 돌비 애트모스의 위력은... 영화 예능 콘서트  음감 드라마 뉴스 모든 걸 다 만족하실거에요.']]",2021.01.13. 10:03,스피커
209,(사무실용) 스피커 두조 연결가능한 저렴한 앰프좀 추천해주세요. 신품으로,사무실에 노는 스피커 두대 연결할려고 합니다. 중고말고 새걸로 저렴한 앰프좀 알려주세요. 비싼거 말구요 ​야마하 데논 마란츠 온쿄 등등 국산알려주시면 중고도 찾아보겠습니다. ​새벽에 오디오 좀 옮겼더니 허리가 골골 합니다​오늘도 화이팅하세요,"[['중국산도 괜찮으시면 알리에 십만원대 tr/tube 앰프 다양하게 있어요'], ['음반음반님 감사합니다 중국산들은 저도 몇대 있는지라.ㅋㅋ 아침맛잇게 드세요'], ['하나 파세요 ^^'], ['그렇다면 야마하 인티앰프들이 있을거 같네요']]",2021.01.13. 09:27,스피커
210,스피커 스탠드 추천 부탁드립니다,스탠드 중에 높이가 95~1미터 정도 되는 제품​어디 없을까요 ? 가격은 상관없습니다 많은 추천 부탁드립니다,[['주문제작하는 수 밖에 없을 듯 합니다 주문제작에 관심있으시면 챗 주십시요~']],2021.01.13. 05:34,스피커
211,맥북으로 음악듣는 분들,앰프에 usb로 앰프연결해서 들으려고 합니다​구글드라이브에 CD리핑한 파일이 좀 있는대​어떤 방식으로 들으시나요?,"[['오디르바나 사용합니다~'], ['댓글 감사합니다'], ['맥북(오디르바나) - DAC - 앰프 - 스피커입니다.'], ['오디르바나 많이 쓰시는군요'], ['맥북 레티나(2012~2015년식) 광지원되는걸로 알고있습니다.오드리니바나- DAC 광단자 -앰프 -스피커'], ['제건 광단자가 빠진 모델이네요 ㅜㅜ'], ['오딜바나가 절대적인 음질인지라. 인터페이스나 디자인은 맘에 안 들지만 어쩌겠어요'], ['감사합니다'], ['어제 아들에게 맥북이 머꼬 물어보니 애플 노트북 제품 이라는데 맞나요'], ['맞습니다^^'], ['맥 계열은 오디르바나가 절대적입니다.'], ['감사합니다'], ['편리함때문에 룬 사용합니다. \n룬+코부즈. 타이달. 음원. \n아이패드로 리모컨 잘되구요.. ^^'], ['감사합니다'], ['처음 ; 맥에어-블루투스5.0DAC(5만대)-아나로그앰프(AUX)-스피커.지금 ; 맥에어 헤드폰단자 -AUX케이블-아나로그앰프(AUX)-스피커.막귀라서 그런지 처음방식이나 지금방식, 소리의 차이는 모르고 듣고 있습니다.주로 유튜브나 다운받은 음원을 듣고요.'], ['저도 막귀라 다행입니다.']]",2021.01.12. 23:34,스피커
