,tit,body,comment,time,keyword
389,스알못 초보 질문드립니다. 45~50만원대 엑티브 스피커 추천 부탁드립니다. 고수님들의 고견을 여쭙고 싶습니다.,안녕하세요 스알못 왕초보입니다. 부모님 연초선물로 스피커 영입하려하는데 고민이 많습니다.우선 후보군은1. 오디오엔진 hd32. 클립쉬 r-41pm  입니다.​넓지않은 거실에서 사용하려 하는데요 5인치 이상 고려안한거는 아무래도 일정음량이상으로 틀면 층간소음 문제도 있고 민폐끼치고 싶지 않아서요hd3는 출력은 괜찮아도 아무리 작아도 거실인데 울림통이 너무 작지 않을까 싶지만연결성이나 사용성이 더 편한거 같아서 많이 기우네요... 그냥 lg공기계 g7 하나 물려서 틀어놓거나 블루투스로 연결 많이 할거 같거든요 음질을 크게 따지기보단 어머니는 트롯트 저는 팝이나힙합edm 아버지는 재즈나 소울음악 들으셔서 모든 장르 듣기 좋은 놈으로 구입하고 싶습니다.  혹시 저 가격대에 다른 제품도 좋은 놈있으면 추천 좀 부탁드립니다.,"[['탄젠트 X5 BT~~ 요놈도 한번 확인해보세여'], ['조금 더 욕심을 낸다면, 클립쉬 더식스를 추천해 봅니다^^;;'], ['감사합니다. 하지만 맥시멈버짓이...50만원이라 ㅠㅠ 아쉽지만 41pm선에서 만족 해야될거 같습니다.ㅎㅎ']]",2021.01.07. 12:59,스피커
390,파워노드2i 벅스사용시 톤 조절 질문,"파워노드2i 에서 벅스가 타이달보다 저음이 부스트되는 느낌입니다.다른 분들은 느낌이 어떠산지요? 현재 톤조절  고 2.5 저 0 세팅입니다.다들 아떻게 설정하셨는지 궁금하네요 ​스피커는 엘락 BS243.3 북쉞프, 스케는 알리발 약 십만원정도 쓰고 있구요. 2M 백금도금프러그, 무산소동선 납짝칼국수 스타일, 알리 4만원짜리 막선보단 힘이 좋아진듯​저음이 크게 들려 슈즈, 부츠, 방진페드 등등 하다가 목재 26센티 싸구려 스텐드로 해결이 많이되긴 했습니다.북쉘프도 무조건 스텐드가 답인거 같더라구요.​파워노드 사용자분들 세팅 좀 알려주세요. 그럼 새해 복 많이 받으세요.​","[['저같은 경우는 톤조절 모드로 들어가면 뭔가 음이 답답해지고 음질에 손실을 주는것 같아, 톤 조절모드 끄고 삽니다 ^^']]",2021.01.07. 12:55,스피커
391,모니터오디오 실버100 내용물중 이건 뭘까요?,모니터 오디오 스피커가 왔습니다. ^^;; 케이블이랑 뭐 소소하게 주문한것들은 다 왔는데 엠프가 배송이 미뤄져서 그냥 스피커만 보고 있습니다. ㅎㅎ​스피커 내용물중에 아래 물건중 바닥에 붙이는 실리콘은 알겠는데 스펀지와 렌치는 뭘까요?궁금합니다. ^^;;,"[['잘모르지만 보통 덕트 (후면) 마개 아닐까요?'], ['그런가봐요 크기가 맞네요. 조심해서 써야겠군요 잘못하면 안으로 밀려 들어갈수도 ㅎㅎ'], ['저도 관ㅅ심가지고 장터 매물 만 보고 있는 스픽입니다 ㅎㅎ비닐봉지에 port plug 이라 씌여져 잇는것 같은데....덕트에 뭔가 이물질 들어가지 말라고 막아놓는것 아닌가요??평소 사용할때는 빼지만...운송이나 기타 보관시 사용??'], ['덕트 마개는 먼지때문에 사용하는게 아니라 막고열고에 따라 저음양을 컨트롤하라고 있는거예요..'], ['오 그렇군요 ㅎ 역시 모르는건 물어봐야해요 ㅎㅎ 감사합니다.'], ['그렇군요....얼마ㄴ전에 덕트에 스폰지 넣어서 안으로 빠졋다는 글도 보았읍니다.....스폰지 막는게 비공식적인 방법인줄 알았는데.....공식적으로 스픽 회사에서도 주는가 보네요,,,,,'], ['저음이 많으면 덕트마개 막고 사용하라고 주는거고...렌치는 잘모르겠네요 ㅎㅎ']]",2021.01.07. 12:52,스피커
392,왕기초 티비-리시버 연결 문의,"안녕하세요?방금 ONKYO CR-N755와 MONITOR 스피커 질문을 드렸는데, 티비 연결 방법도 문의드립니다.쉬운 기능부터 하나씩 연결해보려고 하는데, 집에 있는 티비에서 유투브 음악을 가끔 듣던 것을 리시버+스피커에 연결해서 들어볼까 합니다.기기, 전기를 일도 모르는 제가 후다닥 공부해서 내린 결론은 티비의 ""광디지털 음성출력""과 리시버의 ""OPTICAL DIGITAL IN""을 오디오 광케이블로 연결하는 방법인데, 맞는지요? 근처 문구점에 갔더니 없다하여 인터넷에서 검색하여 주문했는데, 이것도 맞는지요? 미리 여쭤보고 구입하면 좋을텐데, 마음이 급하여...ㅠㅠ도움 부탁드립니다. 꾸벅~","[['네 잘하신겁니다. 티비광출력이랑 셋톱박스광출력이랑 비교하셔서 좋은쪽으로 꼽으셔도 됩니다.'], ['광단자에 연결하는 것 맞습니다.\n이 때 TV 음성출력 설정은 반드시 PCM으로 하세요~\n'], ['감사합니다. 조금전에 택배가 도착하여 셋톱박스와 연결했습니다. 소리의 품질을 평가할 수준이 안되지만 일단 풍성함이 감동적입니다. PCM 설정은 찾아보고 있습니다. ^^;;'], ['혼자서도 알아서 너무 잘 하시는데요?']]",2021.01.07. 12:25,스피커
393,HDMI연결도 앰프내장 DAC를 거치는 건가요?,점심식사 맛있게 하셨는지요?​이번에 HDMI 입출력이 가능한 앰프를 구입하였습니다.(데논 DRA-800H)​디지털입력단자가 아래 사진과 같은데요..,"[['셋탑이 의미하는게 뭘까요? 스피커인가요?아날로그 출력이 되는쪽이 dac입니다hdmi는 디지털출력이구요아날로그 출력은 rca, 이어폰헤드폰단자 등이있어요'], ['셋탑은 TV셋탑박스를 말합니다.(lg헬로비전)'], ['마찬가지예요 굳이 광케이블 별도로 안 하셔도 되고 셋탑에서 설정이 있을 거에요'], ['넵, 알겠습니다..감사합니다.'], ['앰프 내장 DAC를 거치는게 맞는것 같습니다.  앰프와 TV의 연결단자 중 ARC라고 되어있는 곳에 연결하면,  다른 소스에서 TV로 들어간 소리도 앰프로 들어와서 들을 수 있는거구요.https://blog.naver.com/leeno90/221096356678 참고하세요.'], ['링크까지 감사합니다..'], ['hdmi 신호에는 영상 + 소리 입니다.\n즉 셋톱에서 리시버로 hdmi 연결하면 소리 나옵니다.\n셋톱 에서 옵티칼 보다는 소리가 더 좋다는글을 보았는데,\n저는 비교 해보지는 않았구요.\n만약에 hdmi 에서 음성추출하는 방식이 옵티칼 방식 보다 좋다면 알려주세요~\n'], ['넵..근데 제귀로 두가지를 구분해낼지 모르겠네요..ㅎ']]",2021.01.07. 12:22,스피커
394,왕기초 스피커 연결 단자? 도움 부탁 드립니다.,"안녕하세요? 최근에 좋은 음악과 좋은 소리에 급관심이 생겼습니다.아는 이로부터 onkyo CR-N755와 MONITOR 자그마한 스피커를 받았는데, 막귀임에도 한쪽 소리가 약한 느낌이 자꾸 듭니다.살펴보니 좌측 스피커 뒷면에 음극 위아래 브릿징하는 쇠가 거기만 없습니다. 우측 스피커에는 양극, 음극 둘 다 있는데요. 받아오다가 떨어트린 것 같은데, 어디서 구해야 할지 검색해봐도 못 찾겠습니다. 이게 소리에 영향을 주는게 맞는지, 어디서 무슨 이름으로 구할 수 있는지 알려주시면 감사하겠습니다.꾸벅~","[['바이앰핑 핀이네요. 없으면 짧은 선으로 이어야합니다.'], ['점퍼핀인데요..스피커선 잘라서 연결하시면 됩니다.'], ['아래 영상을 참조하세요. 스피커 케이블 연결법을 아예 모르면 처음부터 보시고, 점퍼핀 대체법만 알고 싶으면 11:40초 부터 보셔도 됩니다.https://youtu.be/aeAqRwzwaMk?list=PLCeWvXWfhp6Db6Q09to1G55d0qQv99Lr2'], ['고음과 저음 유닛을 연결해 주는 핀입니다 저 연결핀이 없으면 고음 유닛이 동작을  않으니  고음이 짤린 소리가 납니다 저 연결핀의 재질이 신통치 않아서 고가 스피커가 아니면, 스피커선을 이어서 사용하는게 더 나은 소리를 들려 준다는 게 중론입니다 단자 생김새로 볼때 가운데 원형 부분을 시게 반대 방향으로 돌려주면 빠져나올듯 한데요 제거되면 바나나 단자를 사용 가능할 것 같습니다'], ['아. 공부할게 많네요. 바이앰핑 점퍼핀 검색해보니 라이파이님 말씀처럼 오히려 음질을 저하시킨다는 설명이 보이던데, 전선 잘못 만지면 감전될 것 같아서..하하\n저녁에 스피커선 연결 시도해보겠습니다. \n감사합니다.']]",2021.01.07. 12:05,스피커
395,온쿄 tx-8250 질문드려요,"안녕하세요~  제가 요즘 기변병이 생겨 하루에도 수십번 두근두근오디오와 중고나라를 들어가며 전전긍긍하고 있습니다.. 지금 엠프는 마그낫 ma-600 에 아남  40미니 시리즈 cdp와 튜너를 사용중인데 워낙오래되고 해서 바꿔보려하는데 일단 fm튜너와 cdp, 그리고 난청지역을 감안해서 인터넷라디오와 외장하드에 노래,  블루투스  이렇게 원하다 보니 현재 기기에 네트워크 플레이어(마란츠 nd-8006 또는 야마하 nt-670)를 구매할지 아니면 네트워크엠프(온쿄 tx-8250)에 기존 cdp만 활용중 어떤게 좋을지 궁금합니다.. 가장 중요한 자금이 여유롭지 중고를 알아보고 있는데  조언 부탁드립니다 그리고 제목 처럼 온쿄 8250 엠프가 어떤지도 궁금하고 또 혹시 스피커 4312D를  물리면 충분한지도 궁금합니다.. 고수님들 조언  부탁드립니다ㅠㅠ","[['네트워크 스테레오 리시브 앰프로서 상당히 효율성이 높은 앰프입니다.채널당 160W 고출력 스피커 2조 개별 및 동시 사용 가능하며 HDMI 4조에 USB 와이파이 튜너 광 동축...등등 다기능 앰프로서 음질도 무난한 편입니다...가격대비 매우 실용적인 앰프입니다. '], ['댓글보고 기기 올려두신 글 봤습니다.. 기기에 특성을 모르니 어렵고  그리고 일단 8250을 염두한게 야마하 리시버와 비슷한 가격대라서요.. ㅠ'], ['8270 연락드렸습니다.'], ['판완되었습니다~'], ['답장 감사합니다.'], ['만약에 저라면 앰프랑 스피커는 그냥 사용하시고 말씀하신 cdp+네트워크만 추가할거 같습니다. 온쿄 8250 좋지만 앰프 순수 기능만 보면 지금 사용하시는게 더 좋을거 같습니다.'], ['답변 감사합니다.. 한정된 금액에서 생각하다 보니 고민이 많습니다.. 야마하 정도 네트워크면 지금 엠프에 작당한것 같고..  마란츠는 너무 무리라 생각만 했거든요..'], ['DLNA로만 사용하실거면 자체앱 성능이나 편의성 신경 안써도 되니 선택의 폭이 더 많을거 같습니다. 사용해보진 못했지만 누프라임 옴니아 wr-1도 꽤 좋아보이던데요?'], ['ios기기들을 사용하시면 에어플레이, 안드로이드면 크롬캐스트 오디오만 달아도 사실 매우 훌륭합니다! 단종되었지만 중고로 매우 가격도 저렴하구요'], ['아 이런 제품들도 있네요~  아직 제가 초보라 많은걸 습득하지 못해서요.. 자세한 답변 감사드립니다~^^']]",2021.01.07. 11:14,스피커
396,돌비애트모스 및 서라운드백 스피커 사용여부,안녕하세요.​1. 시스템상 돌비애트모스 인에블드 스피커 한조 또는 서라운드백 스피커 한조를 설치할수 있습니다.어떤 스피커가 영화음향에 더 효과적일까요?​2. 지금  제가 사용중인 넷플릭스 요금제는 돌비애트모스가지원되지 않는 요금제이며 현재 5.1채널 입니다​현재 돌피 애트모스 인에블드 스피커를 설치 안한 상태에서 애트모스 지원되는 넷플릭스 요금제로 바꾸면 음향에 변화가 있는지요? (애트모스 지원 스피커 없이도 더 나은 음향효과가 있는지  알고 싶습니다)​,"[['제경우엔 서라운드백 보단 애트모스가 더 좋았습니다'], ['알겠습니다. 혹시 애트모스 스피커 프론트위에 얹으셨나요? 아님 천정에 달으셨나요?저는 인에이블드 스피커를 프론트에 올려야 되는데 효과가 괜찮을까요?'], ['애트모스 지원 미디어가 그리 많진 않을텐데요 ㅡ 그래도 예전보단 많아지긴 했습니다. ㅡ 돌비 / 애트모스 모두 상술용 브랜드로 이해하심 됩니다'], ['애트모스 13.1 사용자입니다 직접 사용해 보시면 왜 애트모스가 실감되는지 이해되실 거예요 미지원 미디어에도 애트모스 사용하는 것과 안 하는 차이 많이 납니다 카더라 통신 안되시길 ㅡㅡㅡㅡㅡㅡ[애트모스 미지원 상영관 돈주고 보실 마음?]'], ['넷플릭스 포함 아마존 HBO 등등 스트리밍에서 지원하는 애트모스는 별로 기대하지 마세요.애트모스건 dtsx든 블루레이 감상용입니다.전 개인적으로 넷플릭스 영화중에 애트모스 효과 만족한 타이틀 한개도 없습니다.'], ['개인적인 차이가 많이들 있네요 ~'], ['넷플릭스 요금제와 애트모스 음향은 아무 상관없지 않나요?요금제에 따라서 HD, UHD 화질이 달라지는거지 HD화질이면서 음향은 Atmos인것도 있구요.근데 요새 신작 오리지널들은 4K, Atmos 인 경우가 많은건 사실이긴 하죠.저는 현재 5.1.4 로 구성하고 있고 단독주택이라 볼륨은 크게 올리고 보다보니까 넷플릭스 오리지널 작품들중Atmos 음향으로 제작된 작품들보면 블루레이의 True-HD 기반의 Atmos하고는 차이가 좀 있겠짐나 충분히 만족스럽습니다.천장스피커를 4개 달지 않는다면 5.1.2보다는 7.1로 설치하는게 더 좋을것 같습니다.'], ['넵, 의견 감사합니다']]",2021.01.07. 10:31,스피커
397,잘 녹음한 유튜브 스피커 테스트 음원,요즘 이탈리아 밀라노 Sound Sommlier 채널 음악을 자주 듣고 있어요. 블루투스 스피커로 듣고 있지만 음악을 듣는 재미는 원곡을 들을때보다 이 분이 녹음해서 올린 것을 들을 때 더 크네요.디아파송이라는 스피커를 들었을 때는 이게 뭐지 싶을 정도로 차별감을 느껴서 누웠다 일어나서 봤네요.검색해보니 디아파송은 상당히 높은 가격의 스피커네요. ㅠㅠ​드리고 싶은 질문은 이 분의 녹음 기술의 힘이 실질적인 스피커의 소리를 각색해 스피커를 돋보이게 하는 것인가 하는 것입니다. 녹음을 통해 유튜브를 통해 좋게 느껴지는 것이 실제와는 다를 수 있는 것인지입니다.유튜브를 통해 들리는 느낌으로 들린다면 탈탈 털어서 사고 싶습니다.​디아파송 아스테라라는 스피커가 그 값을 할 수 있는 스피커인지 개인적인 의견을 기다립니다. 객관적인 의견을 바라지 않습니다. 그럴 수 없을테니까요. 다만 많은 분의 주관적인 의견을 구합니다.​,[],2021.01.07. 10:09,스피커
398,포노앰프 뭐가 좋을까요?,오늘도 또 질문글을 올립니다;;고민끝에 프로젝트 오디오 데뷰 카본으로 구입을 하려고 합니다. 이제 포노 앰프를 골라야 하는데 지금은 뮤조2에 물려서 사용할 예정이라 어떤걸 사야 할지 몰라서요나중에 스피커를 바꿔서 물릴 수도 있어서 아래 중에 적당한 걸로 추천 부탁 드립니다. 기왕이면 같은 회사 포노 앰프를 물려볼까 해서 골라 봤는데 다른 좋은 대안이 있으면 추천해 주세요. 사진은 위에부터 E->DC->DS->진공관이에요.,"[['포노앰프의 대가 쪼꼬냥님의 글을 찾아보세요'], ['감사합니다~! 근데 턴이 재고가 없대요 ㅠㅠ 수입도 언제 할지 모른다고 하내요'], ['턴테이블은 50만원이하는 그 놈이 그 놈이예요.\n디자인 보고 고르시면 되세요.']]",2021.01.07. 09:40,스피커
