,tit,body,comment,time,keyword
598,톨보이 스피커 vs 북쉘프 스피커,안녕하세요?초보 궁금한게 있어 질문하나 드립니다.스피커종류를 보면 톨보이스피커라는게 있고 북쉘프스피커라는게 있던데요..두종류외에 또다른 종류가 있는진 모르겠지만 일단 이 두종류의 스피커의 차이점이 어떤건지 궁금하고 장단점은 어떤게 있는지 그리고 두스피커는 어떤시스템에 어울리는지 알고싶습니다.또한 가성비로 추천할만한 제품은 어떤것들이 있는지 알고싶습니다.감사합니다.,"[[""http://www.fullrange.kr/ytboard/view.php?id=column&page=1&sn1=&sn=off&ss=on&sc=off&sz=off&keyword=%ED%86%A8%EB%B3%B4%EC%9D%B4&no=110위 글 읽어보세요.결론적으로 취향의 차이입니다.북쉘프는 '상대적으로' 또렷한 소리가 난다.톨보이는 '상대적으로' 저음이 더 많이 나온다.""], ['보내주신링크 감사합니다.\n정독해보겠습니다.'], ['공간에 맞게 쓰시길 추천합니다.'], ['넵~~감사합니다.'], ['일단 우선적으로 감상하실 공간을 결정하시고 톨보이나 북쉘프나 결정을 하셔야합니다^^ 오디오에서 공간이 어쩌면 제일 중요할 수 있겠네요~ 작은 공간에선 보통 북쉘프로~ 거실은 톨보이라고 개념이 잡혀있는 이유가 저음의 공간 울림이 문제가 됩니다. 작은 공간이면 저음의 반사되는 횟수가 늘어나버려서 웅웅~거리게 되고 혼란스럽게 된다고 하네요^^ 요즘 저도 공간의 고민이 많아서 ㅎㅎ'], ['제가 지금 그런 경험을 하고 있습니다.\n소리가 허공에서 들리는 느낌이 나네요.'], ['동일 가격이면 일반적으론 북쉘프가 소리가 좋아요. 다만 북쉘프는 저음에 한계가 있습니다.하지만 일정 가격이 넘어가면 톨보이가 저음까지 두루 소리가 좋은데요, 그렇다고 톨보이를 작은 방에서 사용하면 저음이 감당 안돼 붕붕거릴 수 있어요. 그래서 톨보이는 제대로 된 리스닝 공간이나 거실에서 많이 사용하고, 북쉘프는 방에서 많이 사용합니다. 북쉘프 스피커의 태생부터가 서재의 책장위에 올려놓고 사용하는 스피커에서 시작했습니다만 요즘엔 북쉘프가 중고음에서 장점이 있기 때문에 북쉘프를 메인으로 사용하시는 분도 많습니다. 특히 입문형에서는 톨보이보다는 북쉘프 소리가 월등히 좋기도 하구요.'], ['참고하겠습니다.'], ['먼저 오디오의 역사에서 영화를 빼놓을수 없는데 최초 스피커들은 괴짝으로 크고,무식했습니다 큰영화관을 울려야하니까요경제가 발전하고 생활이 풍성해지고 ,기술이 발달되면서 많은 사람들이 음악을 가정에서도 듣고 싶다는 갈망이 생기면서 가정용 오디오들이 나오기 시작 했습니다.오디오 역사에서 크게 유럽(브리티쉬 사운드),미국(아메리카 사운드) 분류 할수 있는데유럽쪽사람들은 클래식 현악기,금관악기등 여러가지 요소가 들어있는 섬세함을 중요시하면서 중,고역에 많이 치중했습니다음향공학적으로 중음과 고음은 파장이 짦고 직진성이 강해 아주 작은 스피커를 제작이 가능하고이런 음악적 요소와 시대성에 맞추어 책상위에 놓을수 있는 북쉘프 형태들이 나왔습니다하지만 미국의 아메리카 사운드들은 째즈나,금관악기들이 많아 중저역등을 내기에는 북쉘프형으로는 많이 부족한 면들이많아 괴짝에 혼형태들이 많이 나오고 JBL,알텍등은 괴짝에 혼을 혼입하고,나중에는 유럽처럼 섬세한 음을 만들기 위해수정 트위터,리본 트위터,슈퍼 트위터들도 만들어 고음을 보강 했죠그중에 가장역작은 JBL 4344 시리즈같은 거죠 대편성에 수정트위터는 현악,금관악기등을 커버 했으니까요톨보이는 오디오 산업이 퇴보하면서 90년대이후 나온 스피커로 기억 됩니다전자산업이 점점 디지털화 되면서 사람들은 예전에 아날로그 보다는 가정에서 음악과,미디어들을 함께 보고 싶어서북쉘프 보다는 저역이 더풍부한 스피커인 가늘고,긴 톨보이를 양산 했는데 그이후 톨보이는 돌비사의 5.1채널이 나오면서5.1채널 프런트 스피커 대명사가 되었습니다스피커의 형태보다는 자기가 듣고있는 음악적 성향이나,공간적 제약을 가지고 스피커를 선택하시면 보다 즐거운음악생활이 될거라 생각 됩니다아무리 좋은 4344라 해도 우리같은 아파트 문화가 많은 가정에서는 사용하기 힘들고 4344의 진가를 알수 없죠물론 인테리어 효과로 갖고 계신분들도 있습니다오래된 기억으로 쓴 글이라 내용에 오류가 좀 있을수 있을듯 합니다 양해 바랍니다개인적의견으로 이해하시면 좋을듯 합니다'], ['와우~장문의 디테일한 답변 너무나 감사합니다.\n많은 공부가 되네요.'], ['사람이 들을수 있는 주파수 20hz~20000hz 중에서\n스피커가 크고 우퍼가 클 수록 더 낮은 hz까지 소리가나옵니다\n\n보통 작은 북셀프 스피커들은 저음이 50~80hz까지만 나오고\n톨보이라고 부르는 바닥에 놓고 사용하는 큰 스피커들은 50hz 아래 소리까지 재생합니다. 물론 아주비싼 북셀프 스피커는 톨보이만큼 저음이 나오는경우도 있고 저가형 톨보이는 북셀프보다 저음이 덜나오는 경우도 있습니다.'], ['그렇군요..\n감사합니다.'], ['오린이로서 감히 한말씀 올리자면 간단히북셀프 : 또랑또랑하고 스피드가 빠르다톨보이 : 풍성하고 공간장악력이 좋다제가 느낀바로는 이렇구요추천기기는 본인의 예산, 좋아하시는 음악들을 말씀해주시면 고수님들의 많은 추천이 있을 것으로 생각됩니다. ^^'], ['네..감사합니다..^^'], ['제가 거주하고있는 아지트(?)는 거실도 아니고 그렇다고 사방이 막혀있는 룸도 아닙니다.\n10평정도 되는 복층구조의 오피스텔이며 1층은 생활공간 2층이 제가쉬는곳이자 침실입니다.\n2층은 1층과 계단으로 연결되어 있으나 2층 천장고는 180cm정도되며 1층과 2층사이는 2.5미터 정도 됩니다.\n1층과 2층천장까지는 4.3미터정도 되고요. 결론으로 말하면 2층  공간이 막혀있지 않고 뚫린 구조로 1층이 내려다보입니다.\n이런 구조의 공간에선 북쉘프가 맞을까요?\n아니면 톨보이가 맞을까요?\n현제 구형 LG사의 HT564DG라는 제품의 홈시어터를 사용중인데 스피커는 2.1채널 톨보이스피커입니다. 음악이나 티비 소리를 듣다보면 소리가 앞쪽에서 들리는거같지않고 허공에서 들리는다는 느낌이 듭니다.\n어떻게 개선해야될까요?\n참고로 제아지트 스케치해서 올려봅니다..^^'], ['10평이면 절대 작은 공간이 아니고 게다가 천정까지 높으니 톨보이 추천합니다..'], ['얼마 전 어떤 질문글의 답변에서도\n있었지만,\n톨보이가 비교적 작은 볼륨에서도\n저역확보가 용이한 편입니다.\n\n무시 못하는 것이 환경입니다.\n우리나라 일반적인 공동주택 환경\n즉, 아파트 층간소음의 제약 분명있습니다.\n\n그래서 공간 외\n내가 볼륨을 충분히 쓸 수 있나?\n없나?도 \n톨보이를 선택하는 한가지 중요한 요인입니다.\n\n'], ['사실 출력은 스피커가 가지고 있는 10%로도 못쓰고있죠..ㅎㅎ\n오피스텔이라서 좌우에 다른주민들이 살고있어서 조금만 쿵쿵하면 바로 경비 올라옵니다..ㅋ'], ['좋은 북쉘프 가시는 걸 추천드려요. 포컬, B&W, 소너스파베르 급'], ['제가 현제 거주하는 조건에는 북쉘프가 맞을까요?'], ['네, 언급드린 브랜드들 북쉘프면 200와트대 프리/파워가 아닌 인테앰프라도 충분한 저역과 음질 보장해줍니다. 주변 이웃들이 문제겠네요.']]",2021.04.07. 14:04,스피커
599,엠프... 스피커.. 임피던스... 문의.. (초보적 질문),"보통 리비서건.. 엠프건..  임피던스가 설정되어 있습니다. 4옴, 6옴, 8옴... 이러게.. 스피커도 거기에 맞는 8옴 스피커만 사용해야 하는지요? 현재 기존 스피커를 다 정리하고.. 데논 AVR-4308에 보스 101IT 1조를 물려 임시 사용하고 있습니다.​1) 데논 프런트는 8옴.. 보스 101IT는 6옴입니다.. 스피커가 4옴이면?? 안되나요?   이렇게 써도 무방한지요?? ​2) 데논 출력단 스펙입니다.    하기 스펙이면 어느 정도의 스피커까지 무리없이 운용이 가능할까요?    현재 고려중인 제품은.. 포칼 1008BE..  PSB T2.. 입니다. (음악 50/ 영화 50)     4308로는 스피커를 다루기 힘들까요??  프리패스하여 인티앰프라도 달아야하는지요?","[['스피커 옴수는 앰프에 최대 출력에 가깝게 볼륨을 올릴때 어떻게 되느냐 따지는 것입니다. 일반 가정에서는 앰프 출력 1와트 쓰기가 힘듭니다. 10와트면 집 떠나갑니다. 그러니 아무거나 끼우셔도 되어요.'], ['댓글 감사합니다. ^^'], ['좋은 정보 감사합니다'], ['저항은 신경쓰실 필요없을정도로 무시하셔도 됩니다스피커 저항이란것도 음악나올때 수시로 바뀌어요소리의 크기로만 따지면 스피커의 감도를 보시면 됩니다 보통 1m 90db 정도로 표현되는데 1w앰프 출력으로 1m 거리에서 90db 크기의 소리가 난다는 표현입니다90db면 지하철 들어오는소리보다 커서 볼륨으로만 따졌을때 아무런 문제가 없습니다앰프가 기본스로 30w는 넘는데 소리크기야 충분하죠보여주신건 140w니 차고넘칩니다다만 앰프란것이 스피커입장에선 소리로 표현되지만앰프입장에선 순간적인 전류를 흘렸다 뺐다 하는거라 그능력은 그냥 가격대로 간다고 보시는게 맘 편합니다그러나 이게 스피커의 근원적인 음색과 능력을 뛰어넘을 정도는 아니구요적당히 스피커가와 비슷한 가격의 앰프정도? 사시면 된다고 생각해요 반정도 가격도 괜찮습니다'], ['많은 도움이 되었습니다 . 감사합니다.'], ['소리 차이는 발생하지만, 스피커나 앰프에는 그다지 무리가 가지 않습니다가장이상적인건 임피던스 매칭이 될때 스피커에서  출력음압이나, 음장감,음질등 여러가지가 완벽하게나오지만 일반 사람이 비교해서 듣지 않는한 그러게 구분하기 힘듭니다전기적으론  예) 앰프입장에서 8오옴인데 스피커가 6오옴이 걸려 있으면 부가가 적게 걸려서 같은 앰프 볼륨 1을 올려도                     소리 크기 차이가 나는 정도 입니다                     앰프 SPEC,스피커SPEC 이상적으로 도달 하기 위해서는 기술 SPEC 맞추는게 맞지만 임피던스라는게                      교류 저항이라 온도,습도에도 영향을 받기 때문에 현재 갖고 계신 스피커,앰프는 그냥 사용 하셔도                     무리가 없습니다'], ['네... 맘 편하게 사용하다가 스피커도 바꿔보겠습니다. 감사합니다.'], ['이런 조합은 없겠지만\n4옴 40와트 앰프에\n2옴 100와트 스피커 연결하고\n베이스 많이 울리는 음악 큰음량으로 들으면 앰프 망가집니다'], ['그렇게 사용하진 않겠죠? 감사합니다.'], ['리시버는 보통 스테레오 엠프에 비해 전원부가 저임피던스까지 커버하도록 견고하지 않기에... AV용 스피커는 8옴꺼를 사용해주는게 좋습니다. 사실 8옴이라고해서 부하가 항상 8옴에 있는게 아니고 7옴도 되었다가 11옴도 되었다가 시시각각 변합니다. 그래서 사실 8옴이 중요하다기보단 최저옴(Min.  이라 표기) 이 중요합니다.\n두 가지 관점인데, 우선 4옴 스피커인데, 최저임프던스가 2옴이라면.. 리시버에겐 상당히 무리가 갑니다 기기가 서서히 망가질수 있다는 뜻입니다.\n또 한가지는 저항이 내려갈수록 앰프는 부하가 걸려 신호대비 잡음이 많이 낍니다. 그래서 리시버들 스펙을 보면 8옴일땐 0.01%이었는데, 6옴일때 0.1%, 4옴일때 0.1% 뭐 이런 표현들이 많습니다(수치는 그냥 예를 든것입니다)\n이게 의미하는건... 저항이 낮은 스피커을 물렸을때 상당히 음이 나빠진다는 의미입니다(물론 0.1%도 나쁜값은 아니지만 상대적으로 8옴에 비해 현저히 낮아진다는 의미입니다)\n따라서 AV 용은 사실 정말 하이엔드 AV가 아니라면 8옴으로 맞추는게 여러모로 좋고, 하이파이 병행허신다면 프런트만 좋은 스피커(4옴이든 8옴이든) 쓰고 리시버의 프리아웃기능을 활용하여 별도 파워앰프로 프런트만 운용하기도 합니다.\n좀더 하이엔드는 AV프로세스와 각 채널별 모노블럭으로 5개를 구성하여 각각 채널을 하나의 앰프가 담당하기도 합니다 이를테면 오디오랩 8300MB같은걸 5개를 사는거죠;;'], ['정확하게 이해가 되었습니다.현재 프론트에 1조만 연결하면서 사용하기에 큰 무리는 없어 보입니다.답변에 진심으로 감사합니다. 좋은하루 되세요 ^^']]",2021.04.07. 13:35,스피커
600,25평 카페 스피커 질문,안녕하세요 오린이 입니다.현재 시골에서 25평 정도되는 카페 운영중입니다.마샬 액톤2 블루투스 스피커로 스트리밍해서 노래를 틀어놓는데 성에 차지않아서오디오 업그레이드를 진행하려고 합니다.​현재 고민중인 선택지는 두가지 입니다.​1. 북쉘프 스피커 ​2. 빈티지 스피커 ​둘다 턴테이블 물려서 재생하고자 하는데 북쉘프로 가면 공간감이 없을것 같아 고민입니다...그러자고 빈티지를 가자니 중고 물품 구하기가 힘들어 보이고요.. ​북쉘프는 psb xb 정도 생각하고 있고 빈티지는 총알이 모자라서 인켈과 같은 옛날 국산기 정도 생각하는데 괜찮을까요? (근처에 태광 tsp 1000 매물이 나와있는데 고민입니다 ㅜㅜ)어떻게 하는것이 좋을까요 고수님들의 답변 부탁드립니다..ㅎㅎ,"[['북쉘프도 나름인데... 온쿄 꺼 저렴한데 귀에 편해서 까페서 틀기 좋아요'], ['온쿄 북쉘프 괜찮은 가요?? skr 101 이 모델이 근처 매물이 있는데 어떤가요?'], ['사진좀여 검색이 안댐 ㅋ'], ['ㅈㄱㄴㄹ 에 nht로 검색 해보심 물건 많이 있네요 저렴하게'], ['요녀석 입니다'], ['nht 함 알아보겠습니다 ㅎㅎ'], ['얼마에요 느낌좋은대요??!!'], ['제가 온쿄 두조로 쓰고있눈데 자극적이지 않아 좋아요'], ['4만원 입니다!!'], ['무조건 사야죠!!!!!'], ['빈티지는 민트급 아니면 카페 분위기가 올드해지기도 합니다. 매장 인테리어와 주고객층을 보고 결정하셔야 할 것 같아요.'], ['그렇군요,,, 민트급 빈티지는 비싸니,, 북쉘프쪽으로 생각을 좀 해봐야겠네요'], ['24평 음장감이나 전체적인 음악의 감미로움을 위해 간편하고,디자인도 이쁜 보스라이브스타일이나보스 스피커 301 Seri 벽설치가 음악적 분위기가 감미로울거라 생각됩니다비용도 적게 들고 굳이 비싸게 안하셔도 요즘은 AV용 블루투스가 저렴하게 잘나오니 유튜브 음악을 틀어도소스가 많고 장르,감미로운 음악을 즐기실수있을듯합니다저도 처형님 카폐 그렇게 해드렸습니다 가격도 저렴하면서 효과 만점입니다'], ['설탕벌님 의견에 10표 추가합니다.\n\n매장에는 거의 무조건 보스 310-5나 201-5를 천장에 가까운 벽에 설치 하시기를 추천합니다.\n\n디자인 깔끔하고, 손님들(특히 아이들)이 함부로 손 댈 염려없고, 가격 저렴하고 음질도 괜찮습니다.\n'], ['근처 몇몇 카페는 데피니티브 테크놀로지나 달리의 온월 타입 스피커도 많이 쓰더군요.  아이들 손 안닿는 높이에 대각선이나 마주보게 설치한 경우가 많던데 나쁘지 않더라고요.  아주 구석이 아니라면 스테레오 감각도 살고요.']]",2021.04.07. 13:15,스피커
601,[앰프추천] B&W 804S 스피커에 빈센트 vs 데논 어느게 나을까요?,"안녕하세요.​스피커 B&W 804S 에 매칭할 앰프로빈센트 SV-237MK데논 2500ne데논 A110이정도 생각중인데 어느게 잘 맞을까요?​거실에서 주로 팝, 가요를 듣습니다.​아니면 다른 모델 추천 부탁드립니다.​​","[[' 대논 pma 110이면 최상일것 같고Pma 2500ne도 좋습니다.'], ['예 고맙습니다~'], ['일전에 주기표님 유튜브에서 빈센트 모델을 강추하더군요전문가로서 추천할 비장의 무기 같이 설명하던데 스피커가 꽤 고사양이니 빈센트가 좋아보입니다^^']]",2021.04.07. 11:48,스피커
602,"트렌스미터?사용에 대한 궁금점이 있습니다(다인 커넥트, 포메이션 오디오 b&￦)","스피커라고는 컴퓨터에연결해서쓰던 로지텍스피커와 티비 사운드바 jbl9.1만 쓰던 사람입니다. 얼마전부터 스타필드 이런곳에가보면서 드비알레니 제네바니 스피커를 들어보면서 하이파이 오디오에도 관심이 생기기 시작해서 이사와 함께 엑티브 스피커를 들여보려고 하는데 한가지 질문점이있습니다.​소스기기로는 빔프로젝터 혹은 핸드폰을 이용한(에어플레이 혹은 블루투스) 연결을 고려하고 있습니다. ​빔프로젝터 특성상 오디오와 소스기기가 반대편에 위치시켜야하니 무선을 통해 연결해야하는데 매번 킬때마다 연결시키는게 귀찮기도하고 블루투스 방식은 좋지 않다고 하여 고민하던중​다인오디오 xeo시리즈 (focus포함 주로 20xd를 보고있습니다)의 트랜스미터인 다인 커넥트와b&w의 포메이션 듀오의 포메이션 오디오를 보게되었는데​위의 다인의 커넥트와 포메이션 오디오를 빔프로젝터에 유선으로 연결해두고 무선으로 스피커에 신호를 쏘는 방법으로 생각하고 있습니다.​첫번째 질문은, 이 방법을 통해 소리를 전달할 수 있는가? 인데 두제품을 아무리찾아봐도 어떻게 연결하고 어떻게 쓰고 어떤기능을 하는 제품인지 찾아보기 어려워서 질문드립니다.​두번째는 위의 방법을 이용했을때, 프로젝터나 핸드폰의 블루투스로 스피커로 쏘는것보다의 이점이 있을까요?​카페를 들락거리면서 열심히 찾아봤는데 너무 초보적인 질문이라 그런가 이런질문을 하시는 분은 거의 안계서서 질문드려봅니다 ㅎㅎ..​추가적으로 음악은 잡식으로 가리지 않고 들을예정이고 주로 유튜브로 영상을 틀어놓고 노래를 듣는걸 좋아하는데 이에 합당한 스피커가 추가적으로 있다면 추천 부탁드립니다.현재 고려하고있는 스피커는 (kef ls50 w2, 포메이션 듀오, xeo30, focus 20xd)정도 입니다.(어렵지 않다면 패시브스피커도 매력이 있다고 생각했으나 소리를 찾지말고 음악을 즐기라던 분들의 댓글을 보고 엑티브 쪽으로 마음을 두었습니다)","[['다인 커넥트 사용하고 있습니다. 커넥트를 프로젝터에 붙이고 무선으로 다인 액티브 스피커로 전송할 수 있습니다.\n\n블루투스 보다 훨씬 많은 음악 데이터를 전송하는 방식이므로 음질면에서 상대가 안됩니다.'], ['좋은정보 감사합니다 ㅎㅎ :) 덕분에 궁금증이 정확한 부분이 정확하게 해결되었네요.']]",2021.04.07. 11:27,스피커
603,ls50 w2 는 스피커 사이 인터케이블 없이 무선연결로도 mqa 해상도를 다 뽑아낼수 있나요 ?,제목 그대로 입니다.​진정한 무선 고해상도 재생이 가능한지 궁금합니다.​​,"[['무선은 96/24로 된다합니다.  매뉴얼에 나오네요. 근데 최종단에서 이 샘플율이면 충분하다고 생각합니다'], ['답변 감사합니다. 사실상 충분한 스펙인것 같습니다.'], ['자체 와이파이 설정으로 재생했던것 같은데요?']]",2021.04.07. 11:18,스피커
604,미국 아마존에서 구입할만한 케이블 류가 있을까요?,"안녕하세요.​텔로스7과 소프라2에 물려줄 케이블류를 알아보고 있는데요..​미국 아마존에 적립금이 210불이 있는 것을 보고, 아마존에서 구매할 만한 케이블이 있는지 기웃거려 봤습니다.​오디오퀘스트 케이블은 한국이나 별반 차이가 없어 제외하였는데요..​혹시 아마존에서 상대적으로 한국보다 싸게 파는 스피커나 파워 케이블류가 있을까요?​벌크류는 좀 저렴한거 같던데, 추천 부탁드립니다..^^","[['아마존에서는 선재는 거의 정가로 팔아서 제 값 주셔도 필요 하신거 사시는게 좋을거 같습니다. Manufacture에서 세일 안하면 안합니다.  seller가 마진율이 있어도 가격을 내릴수 없는 구조 입니다.'], ['차라리 아마존에서 필요 하신거 구입하시고 USAudiomart 추천 드립니다. 중고 선재 반값이하로 구입할수 있습니다'], ['답글 감사합니다. 그냥 케이블은 한국에서 구하는게 좋을 것 같네요..^^'], ['네 그러는게 좋으실거 같아요. 한국에 판매하는 선재가 가격 좋은 경우도 많아요 ㅎ']]",2021.04.07. 11:11,스피커
605,입문용 모니터 스피커,"제가 이제 미디작곡쪽에 입문해서 모니터 스피커를 하나 사려고 하는데 추천해주실만한 스피커가 있을까요?예산은 50정도 생각하고 있고 아담t5v, eris e5, 야마하 HS5 등 추천부탁드려요~","[['탄노이 골드 시리즈도 많이들 쓰시더군요.'], ['답변감사합니다~'], ['야마하나 베링거 모니터용으로 많이 쓰시던데요'], ['답변 감사드려요~']]",2021.04.07. 11:07,스피커
